"","sentence","head","tail","relation"
"5055","According to Beniaminov, attendees at the dinner included Aras Agalarov, Donald Trump, Aras Agalarov's wife and daughter, Emin Agalarov, Emin Agalarov's friends Murad and Timur Beniaminov, Roman Beniaminov (no relation), Rob Goldstone, Goldstone and Agalarov's associate Murtaza Akbar, Trump Organization employees Keith Schiller and Michael Cohen, Miss Universe employee Esther Swan, former-Miss Universe Olivia Culpo, and others.","Roman Beniaminov","Olivia Culpo","neutral2"
"5056","In the memoranda to Kolesnikov, Akhmetov, and Lyovochkin, Manafort also wrote that he was interested in Ukrainian politics and implied he might be interested in assisting them: I am watching intently at the prospects ofa new Ukraine government potentially forming in the coming days.","Manafort","Kolesnikov","positive1"
"5057","Shortly after Graff's email, Scavino replied to Goldstone, copying Graff and Trump Jr. He wrote:","Scavino","Graff","neutral1"
"5058","On December 14, 2014, Jason Tropea emailed a Crocus employee, writing: ""Emin has asked me to review and study the Trump org. / Crocus contract for the residential tower.","Emin","Jason Tropea","neutral2"
"5059","Bannon was Ivanka Trump and Jared Kushner’s public enemy; they expected nothing of him.","Bannon","Jared Kushner","negative2"
"5060","Felix Sater, Donald Trump Jr. and Ivanka Trump stayed at the National Hotel together, and I did what their dad asked me, keep an eye on them.","Felix Sater","Donald Trump Jr.","neutral2"
"5061","Mr. Kosachev hands Mr. Rohrabacher a note on a piece of paper and says: ""Would you be willing to accept sensitive documents?"" . . .","Kosachev","Rohrabacher","positive1"
"5062","On the evening ofApril 10, 2016, Manafort emailed Kilimnik.","Manafort","Kilimnik","neutral2"
"5063","On July 22, 2016, WikiLeaks released over 20,000 emails and other documents stolen from the DNC computer networks.","WikiLeaks","DNC","neutral2"
"5064","So Irakly “Ike” Kaveladze was a bit nervous that Irakly “Ike” Kaveladze and Natalia Veselnitskaya are not going to have much time to read it because Natalia Veselnitskaya was running late.","Irakly “Ike” Kaveladze","Natalia Veselnitskaya","negative1"
"5065","“Mr McGahn will not comment on his legal advice to the president,” said Mr McGahn’s lawyer, William Burck.","William Burck","McGahn","neutral1"
"5066","The first known Twitter correspondence between the two GRU personas occurred on September 15, 2016, when the Guccifer 2.0 account notified the DCLeaks account that WikiLeaks was seeking to communicate with it through secure email.","Guccifer 2.0","DCLeaks","neutral2"
"5067","In his decade at the center of Trump’s inner circle, Cohen styled himself as the tycoon’s pugnacious man Friday, an indefatigable loyalist who aped his boss’s husky-voiced bluster.","Cohen","Trump","positive1"
"5068","Later, after the filing of a winding up petition in which Kilimnik was named as a participant in Pericles, Kilimnik claimed that when Pericles started in 2007, Kilimnik was working for Manafort and living in Moscow and that he had ""zero involvement in this thing, did not even manage translation of documents.""","Kilimnik","Manafort","neutral1"
"5069","The GRU used this website and affiliated social media personas to promote and disseminate stolen documents from the DNC and DCCC, while obscuring the GRU's involvement in the influence campaign.","GRU","DCCC","negative1"
"5070","The data was subsequently leaked by GRU personas and WikiLeaks at strategic moments during the 2016 election, as part of a coordinated hack--and-leak operation intended to damage the Clinton Campaign, help the Trump Campaign (the ""Campaign""), and undermine the U.S. democratic process.","WikiLeaks","the Clinton Campaign","negative1"
"5071","Caputo notified Roger Stone and brokered communication between Stone and Oknyansky. Oknyansky and Stone set up a May 2016 in-person meeting","Stone","Oknyansky","neutral2"
"5072","In addition, the GRU had very likely used direct messaging between the Guccifer 2.0 and DCLeaks personas to mask the hand of the Russian government.","GRU","the Russian Government","positive1"
"5073","The Rotenbergs have amassed their wealth largely through obtaining lucrative Russian government contracts.","Rotenbergs","Russian government","positive1"
"5074","However, if true, this lends support to the conclusion that Cohen's initial false statements to the Committee were aided by other members of the alleged JDA, namely the Trump Organization.","Trump Organization","Cohen","positive1"
"5075","Kushner and his wife, Ivanka Trump, who are both senior advisers to Donald Trump, were angered by revelations about Bannon’s interactions with Special Counsel Robert Mueller that emerged on Saturday, three people familiar with the matter said","Ivanka Trump","Donald Trump","positive2"
"5076","Their narrative was not a pro-troops defense; instead, it was about Bannon’s leaks and his use of right-wing media to besmirch McMaster, “one of the most decorated and respected generals of his generation.”","Bannon","McMaster","negative2"
"5077","The next day, Conway was on Twitter fending off reports of her own demise–“Uninformed chatter doesn’t matter”–just hours before the Office of Government Ethics suggested that the White House discipline her for likely breaking government rules when she endorsed Ivanka Trump’s fashion line on live television.","White House","Conway","negative2"
"5078","The day after the public announcement that Manafort joined the Trump Campaign on March 29, 2016, Gates sent Kilimnik an email with five attachments and instructions regarding those attachments.","Gates","Kilimnik","neutral2"
"5079","Assange had access to the internet from the Ecuadorian Embassy in London, England.","Ecuadorian Embassy","Assange","positive1"
"5080","Emin Agalarov wrote back, ""On it.""","Emin Agalarov","Rob Goldstone","neutral2"
"5081","Other senior Trump Campaign advisors, including Flynn, Kushner, Manafort, Lewandowski, then Senator Jeff Sessions, and Trump Campaign policy advisor Sam Clovis also expressed interest in obtaining the emails.","Flynn","Trump Campaign","positive1"
"5082","Mr. A [Agalarov] just called Rob Goldstone re this.","Agalarov","Rob Goldstone","neutral2"
"5083","Flynn responded by recommending that McFarland not meet with Manafort ""until we're in the hot seats,"" presumably a reference to their taking official roles in the U.S. Government.","Flynn","McFarland","positive2"
"5084","Gates recalled that Manafort and Deripaska used to meet regularly and had a number of different projects ongoing.","Manafort","Deripaska","neutral2"
"5085","Manafort and Kushner both recalled speaking to Trump Jr. after the meeting.","Manafort","Trump Jr.","neutral2"
"5086","According to one of Smith's business associates, Smith believed Ledeen's initiative was not viable at that time.","Smith","Ledeen","negative1"
"5087","The letter with the note was emailed by a staffer at the Trump Organization to Emin Agalarov, who responded, ""Amazing Thank you.""","Trump Organization","Emin Agalarov","positive1"
"5088","On June 9, 2016, for example, a Russian lawyer met with senior Trump Campaign officials Donald Trump Jr., Jared Kushner, and campaign chairman Paul Manafort to deliver what the email proposing the meeting had described as ""official documents and information that would incriminate Hillary.""","Jared Kushner","Paul Manafort","neutral2"
"5089","Manafort admitted that Kilimnik did not need to state the obvious that Manafort could benefit financially.","Kilimnik","Manafort","positive1"
"5090","According to Konstantin, they [Konstantin and Manafort] were having breakfast with the president, President Yanukovych","Konstantin","Yanukovych","positive2"
"5091","Cohen said that Trump responded with words to the effect of, ""That's great. Let me know.""","Trump","Donald Trump Jr.","neutral2"
"5092","“Check out the attachment of me with the ‘Donald,’” Cohen wrote in a 2006 email to Gene Freidman, who managed his taxi medallions.","Cohen","Gene Freidman","neutral2"
"5093","On March 6, 2016, Clovis wrote an email update to senior Campaign members, including Jared Kushner, Ivanka Trump, Corey Lewandowski, Michael Glassner, and Stephen Miller, explaining that he had ""made contact with everyone in the matrix ...","Clovis","Ivanka Trump","neutral2"
"5094","An initial meeting in Moscow was attended by Louis Freeh, then-Russian Prosecutor General Yuri Chaika, the Russian Deputy Prosecutor General, Peter Katsyv, Imre Pakh, and the Associate Managing Director at Freeh's firm.","Louis Freeh","Yuri Chaika","neutral2"
"5095","In 2010, after Assange was arrested in England for questioning by Swedish authorities on rape allegations, Putin made statements supportive of Assange.","Putin","Assange","positive1"
"5096","When he later learned that Nunberg had been subpoenaed to testify before the Grand Jury, Stone denied meeting with Assange and claimed he had been joking.","Nunberg","the Grand Jury","neutral1"
"5097","By June 2016, Sater, through his contacts in Russia, had helped organize an invitation for Cohen to attend the St. Petersburg International Economic Forum (SPIEF).","Cohen","St. Petersburg International Economic Forum (SPIEF)","neutral1"
"5098","But what Natalia Veselnitskaya was told, correspondingly, Aras, Natalia Veselnitskaya's client, when he reacted to Natalia Veselnitskaya's request to think about how he might help Natalia Veselnitskaya, with whom he might introduce Natalia Veselnitskaya to in the United States, he gave Natalia Veselnitskaya the contact details of an individual in the United States, Mr. Irakli Kaveladze.","Aras","Natalia Veselnitskaya","positive1"
"5099","Michael Cohen’s mother, Sondra, was a nurse.","Michael Cohen","Sondra","positive2"
"5100","The GRU operated the DCLeaks Twitter account, @dcleaks _, from the same computer it used for other interference efforts, including the Twitter account @BaltimorelsWhr, which encouraged a ""flash mob"" and posting of images to oppose Clinton.","GRU","Clinton","negative1"
"5101","As the general election approached, Scavino, a member of the communications team who also had a role in administering Trump's Twitter account during the Trump Campaign, increasingly forwarded updates relating to WikiLeaks to other Trump Campaign officials, using subject lines like ""WIKI ABOUT TO DROP SOME BOMBS ... 4 pmE"" and ""The WikiLeaks BOMB!"" and linking to the latest WikiLeaks twitter post or its website.","Scavino","Trump Campaign","neutral1"
"5102","Shamir in tum provided them to Belarus's Aleksandr Lukashenko, an authoritarian leader who relied on the documents to-justify the arrest of opposition figures on allegations of spying for the United States.","Shamir","Aleksandr Lukashenko","positive1"
"5103","But Donald Trump has continued to privately discuss the matter, including the possible appointment of a second special counsel to investigate both Mrs Clinton and Mr Comey, according to two people who have spoken to the president about the matter.","Donald Trump","Clinton","negative1"
"5104","Kilimnik and Manafort secretly coordinated on Ukraine matters, practicing communications security through the continued use of foldering.","Kilimnik","Manafort","positive2"
"5105","This report provides further evidence of an extensive conspiracy between the TRUMP campaign and the Kremlin, sanctioned at highest levels and involving Russian diplomatic staff based in the US.","TRUMP campaign","KREMLIN","positive2"
"5106","When U.S. media published Kilimnik's name in August 2016, Kilimnik returned to Russia, allegedly for protection.","Kilimnik","Russia","positive2"
"5107","Although Stone no. longer had a formal position on the Campaign at this time, the Campaign ""still had people he knew,"" including Trump, Gates, Paul Manafort, and (later) Steve Bannon, and Stone ""had the ability to access these people.""","Stone","Trump","neutral1"
"5108","Goldstone told Shugart about Garten's outreach.","Goldstone","Shugart","neutral2"
"5109","For example, the GRU released specific sets of DCCC documents related to races in Florida on August 15, 2016, and to races in Pennsylvania on August 21, 2016.","GRU","DCCC","negative1"
"5110","Gates responded to Mermoud's text, ""Yes. Will call shortly. Going to try and do it.""","Gates","Mermoud","neutral2"
"5111","Kilimnik separately continued to push the Yanukovych peace plan with Manafort and others.","Kilimnik","Manafort","neutral2"
"5112","Emin Agalarov told the Committee that Trump discussed running for president at the time, but that Trump said he did not know if he would run.","Emin Agalarov","Trump","neutral2"
"5113","The Russian contacts consisted of business connections, offers of assistance to the Trump Campaign, invitations for candidate Trump and Putin to meet in person, invitations for Trump Campaign officials and representatives of the Russian government to meet, and policy positions seeking improved U.S.-Russian relations.","Trump","Putin","neutral2"
"5114","Page’s views may be compromised by his investment in Russian energy giant Gazprom.","Page","Gazprom","positive1"
"5115","For example, in early 2016, Vasiliy Anisimov, a Russian oligarch with ties to Vladimir Putin and ties to organized crime, sought to hire Louis Freeh, an American lobbyist and former Director of the FBI, to work with Veselnitskaya on the Prevezon case.","Vasiliy Anisimov","Veselnitskaya","neutral2"
"5116","After the associate expressed concern over Manafort and Trump, Kilimnik told the associate in a subsequent email that Manafort is a very good strategist and that there could be surprises, even in American politics.","Kilimnik","Manafort","positive1"
"5117","On November 23, 2016, Kaveladze, having already been met with skepticism from Goldstone about a second meeting, indicated to Goldstone that Veselnitskaya was willing to change her flight if needed.","Goldstone","Kaveladze","negative1"
"5118","Gates told the FBI that he joked about Kilimnik being a Russian spy because he did not know for sure if Kilimnik was a Russian intelligence officer.","Gates","FBI","neutral2"
"5119","In his conversation with Mr McGahn, Donald Trump asked what stopped him from ordering the Justice Department to investigate Mr Comey and Mrs Clinton, the two people familiar with the conversation said.","Donald Trump","Mr Comey","negative1"
"5120","For example, at the time they were deactivated by Facebook in mid-2017, the IRA's ""United Muslims of America"" Facebook group had over 300,000 followers, the ""Don't Shoot Us"" Facebook group had over 250,000 followers, the ""Being Patriotic"" Facebook group had over 200,000 followers, and the ""Secured Borders"" Facebook group had over 130,000 followers.","Facebook","""Being Patriotic""","negative1"
"5121","On another, Michael Cohen was flying to Iowa on a Trump jet to float the boss’s name as a presidential possibility.","Michael Cohen","Trump","positive1"
"5122","Following the June 9, 20 16, meeting in Trump Tower and the birthday painting delivery, Goldstone continued to contact Trump Jr. and others on a range oftopics.","Goldstone","Trump Jr.","neutral1"
"5123","Senior leaders of the PoR, who paid Manafort and with whom Manafort maintained close personal relationships, were reliant on corruption and organized crime. For example, Yuriy Boyko and Dmytro Firtash two Ion -time allies and funders of the PoR who maintained close relationships with Manafort.","Yuriy Boyko","Manafort","positive2"
"5124","Jared Kushner had failed to disclose any foreign contacts, including meetings with Sergey Gorkov to the United States and the head of a Russian state bank.","Jared Kushner","Sergey Gorkov","neutral2"
"5125","Kaveladze responded, ""I know.","Kaveladze","Rob Goldstone","neutral2"
"5126","On May 17, 2017, Acting Attorney General Rod Rosenstein appointed the Special Counsel and authorized him to conduct the investigation that Corney had confirmed in his congressional testimony, as well as matters arising directly from the investigation, and any other matters within the scope of 28 C.F.R. � 600.4(a), which generally covers efforts to interfere with or obstruct the investigation.","Rod Rosenstein","Special Counsel","positive1"
"5127","So Rob Goldstone and Irakly “Ike” Kaveladze politely kind of gradually tried to explain to Natalia Veselnitskaya that the meeting is not going to happen, because Natalia Veselnitskaya's like: I'm here, but then I have to go to Moscow, and then I'm willing to come back; if they confirm a meeting I would definitely come back, and stuff like that.","Irakly “Ike” Kaveladze","Natalia Veselnitskaya","neutral2"
"5128","Cohen stated that he and Rtskhiladze were friends and that he spoke to, and spent time with, Rtskhiladze on a ""regular basis.""","Cohen","Rtskhiladze","positive2"
"5129","On January 19, 2016, Goldstone emailed Trump Jr. and copied Graff.","Goldstone","Graff","neutral2"
"5130","Several days later, on November 27, Kaveladze followed up with Goldstone, apologizing for bothering him on a Sunday, and said that Veselnitskaya ""called again asking about the meeting with T [Trump] people.""","Kaveladze","Goldstone","neutral2"
"5131","Stolen documents included the DNC's opposition research into candidate Trump.","DNC","Trump","negative1"
"5132","Mr Trump’s lawyers also privately asked the Justice Department last year to investigate Mr Comey for mishandling sensitive government information and for his role in the Clinton email investigation.","Comey","Clinton","negative1"
"5133","In the early parts of the 2016 election, before WikiLeaks had received hacked materials from the GRU, Assange expressed his opposition to Hillary Clinton's candidacy.","Assange","Hillary Clinton","negative1"
"5134","Section lII of this Report details the Office's investigation into the Russian hacking operations, as well as other efforts by Trump Campaign supporters to obtain Clinton-related emails.","Trump Campaign","Clinton","negative1"
"5135","On June 16, 2015, the day that Trump announced his candidacy, Goldstone emailed Graff and Trump Jr. with the subject line, ""Please pass on mine and Emin's best wishes and congratulations to Mr. Trump.""","Emin","Trump Jr.","positive1"
"5136","On June 30 (another day that Guccifer 2.0 posted commentary on line), Stone called Rhona Graffs line at the Trump Organization for eight minutes.","Stone","Rhona Graffs","neutral2"
"5137","Cohen's role had grown following the departure of Paul Manafort as Trump campaign manager in August 2016.","Manafort","Trump campaign","negative1"
"5138","On either May 15 or 16, he had dinner with Stone and Corsi, and Malloch understood that Stone ""still had an unofficial role in the campaign and Trump listened to him,"" so Malloch stayed in touch and offered to help with opposition research.","Malloch","Corsi","neutral2"
"5139","An individual named Nagi Idris, another director at LCILP, facilitated the introduction between Papadopoulos and Mifsud while they were in Rome.","Nagi Idris","Mifsud","neutral1"
"5140","Michael Cohen, Donald Trump's embattled personal fixer, and Felix Sater, who helped negotiate deals around the world for Donald Trump's, led the effort.","Felix Sater","Donald Trump","neutral1"
"5141","On November 8, 2015, Trump wrote to Aras Agalarov:","Trump","Aras Agalarov","neutral2"
"5142","Stone had known Trump for years and had served as an advisor to the Trump Campaign from late 2014 until approximately August 2015.","Stone","Trump Campaign","neutral1"
"5143","Around the time that the DNC announced in mid-June 2016 the Russian government's role in hacking its network, the GRU began disseminating stolen materials through the fictitious online personas ""DCLeaks"" and ""Guccifer 2.0.""","DCLeaks","GRU","neutral1"
"5144","[To: Jared Kushner] [To: Paul Manafort] [From: Donald Trump Jr.]","Trump Jr.","Paul Manafort","neutral2"
"5145","Lyovochkin, Yanukovych's former chief of staff, helped lead the consolidation of the OB with the backing of Akhmetov, Yanukovych's longtime sponsor.","Akhmetov","Yanukovych","positive1"
"5146","Cohen said that, at the time, he did not know what meeting Trump Jr. was referring to, and did not ask because he did not feel it was appropriate.","Cohen","Trump Jr.","neutral2"
"5147","Issues related to Manafort's historical involvement with Deripaska and the PoR continued through Manafort's entry into the Trump Campaign in 2016.","Manafort","Deripaska","neutral2"
"5148","The Russian Embassy made contact hours after the election to congratulate the President-Elect and to arrange a call with President Putin.","Russian embassy","President-elect","positive1"
"5149","Manafort used contacts with Roger Stone and Tom Barrack, both of whom were longtime associates of Trump, to lobby for a position on the Trump Campaign.","Manafort","Roger Stone","positive2"
"5150","On June 28, 2013, Graff emailed Shugart and Goldstone and attached a final signed copy of the letter.","Graff","Shugart","neutral2"
"5151","Communications between WikiLeaks and GRU personas, coupled with forensic analysis of documents, suggest that at least some Podesta emails could have been transferred as late as September 2016.","GRU","Wikileaks","positive1"
"5152","Carter Page, a little-known adviser to Donald Trump stunned a gathering of high-powered Washington foreign policy experts meeting with the visiting prime minister of India, Narendra Modi","Carter PAGE","Narendra MODI","neutral2"
"5153","Barbara Ledeen and Peter Smith were among the people contacted by Flynn.","Flynn","Barbara Ledeen","neutral2"
"5154","Cohen and Rtskhiladze contacted John Fotiadis, a U.S.-based architect, and had Fotiadis create architectural renderings for a skyscraper.","Rtskhiladze","John Fotiadis","neutral2"
"5155","On March 20, 2017, in open-session testimony before HPSCI, Comey stated: I have been authorized by the Department of Justice to confirm that the FBI, as part of our counterintelligence mission, is investigating the Russian government's efforts to interfere in the 2016 presidential election, and that includes investigating the nature of any links between individuals associated with the Trump campaign and the Russian government and whether there was any coordination between the campaign and Russia's efforts ....","Department of Justice","Comey","positive1"
"5156","According to Beniaminov, attendees at the dinner included Aras Agalarov, Donald Trump, Aras Agalarov's wife and daughter, Emin Agalarov, Emin Agalarov's friends Murad and Timur Beniaminov, Roman Beniaminov (no relation), Rob Goldstone, Goldstone and Agalarov's associate Murtaza Akbar, Trump Organization employees Keith Schiller and Michael Cohen, Miss Universe employee Esther Swan, former-Miss Universe Olivia Culpo, and others.","Timur Beniaminov","Emin Agalarov","neutral2"
"5157","Cohen described Poliakova as ""extremely professional"" and ""very detailed in her questions regarding the project.""","Cohen","Poliakova","positive1"
"5158","WikiLeaks did not respond on Twitter. But on June 15, the day after The Washington Post published the first article detailing suspected Russian hacking of the DNC, the GRU's Guccifer 2.0 persona referenced WikiLeaks in its first blog post, claiming that it had given ""thousands of files and mails"" stolen from the DNC to Wikileaks, which would ""publish them soon.""","The Washington Post","Russia","negative1"
"5159","Michael Cohen testified to the Committee that he was present in Trump's office when Trump Jr. came into the office and, in a manner that was uncommon, walked toward the back of Trump's desk and leaned over and quietly said, ""The meeting. It's all set.""","Michael Cohen","Trump Jr.","neutral1"
"5160","“You don’t know how much trouble you are in,” Steve Bannon screamed, telling Hope Hicks that if she didn’t get a lawyer he would call her father and tell him he had better get her one.","Steve Bannon","Hope Hicks","negative1"
"5161","Mikhail Posokhin is a widely-known Russian architect and developer who has completed a large number of Russian government projects, including renovations of many Kremlin offices and residences, as well as the residence of the Russian President (Kremlin Building Number 1), according to Posokhin's personal website.","Mikhail Posokhin","Russian government","positive2"
"5162","Michael Cohen’s father, Maurice, a surgeon, was born in Poland in 1935 and survived the “gulags of Siberia,” according to a letter he wrote to the judge who sentenced his son.","Michael Cohen","Maurice","positive2"
"5163","Millian is a Belarusian-born American citizen, and as of 2018 was the president of the Russian- American Chamber of Commerce and a real estate broker in New York City.","Millian","Russian- American Chamber of Commerce","neutral1"
"5164","Carter Page was likely a subject of interest to Russian officials during the 2016 election, given that he was the only member of the Trump Campaign's foreign policy advisory team publicly identified as a Russia expert.","Russian officials","Carter Page","neutral1"
"5165","During the 2013 trip to Moscow for the Miss Universe Pageant, two Agalarov employees, Artem Klyushin and his then-wife Yulya Klyushina, spent time with Donald Trump.","Artem Klyushin","Yulya Klyushina","positive2"
"5166","So at that point, Paula Shugart was led [by Rob] to believe that Paula Shugart didn't hear what she thought she heard.""","Paula Shugart","Rob","negative2"
"5167","Kilimnik was placed in a managerial role within Manafort' s firm, eventually becoming head of the Ukraine office and having ""power of attorney"" as the office director.","Kilimnik","the Ukraine office","neutral2"
"5168","By early February 2016, George Papadopoulos agreed to join LCILP and began working in London.","George Papadopoulos","LCILP","neutral1"
