"","sentence","head","tail","relation"
"2451","Sater also recalled that Mishakov had managed at least one project for Deripaska in Moscow.","Mishakov","Deripaska","neutral1"
"2452","Rtskhiladze wrote that it was a letter to the mayor of Moscow, who at the time was Sergey Sobyanin.","Sergey Sobyanin","Moscow","neutral1"
"2453","Shortly afterward, Trump tweeted: ""Very little pick-up by the dishonest media of incredible information provided by WikiLeaks. So dishonest! Rigged System!""","Trump","WikiLeaks","positive1"
"2454","Manafort used contacts with Roger Stone and Tom Barrack, both of whom were longtime associates of Trump, to lobby for a position on the Trump Campaign.","Manafort","Tom Barrack","positive2"
"2455","In the morning of Monday, May 8, 2017, Donald Trump met in the Oval Office with senior advisors, including McGahn, Priebus, and Miller, and informed them he had decided to terminate Comey.","Donald Trump","Priebus","neutral2"
"2456","Kaveladze has insisted that he had no involvement in an wrongdoing, calling the GAO investigation a ""witch hunt.""","GAO","Kaveladze","negative2"
"2457","According to Beniaminov, attendees at the dinner included Aras Agalarov, Donald Trump, Aras Agalarov's wife and daughter, Emin Agalarov, Emin Agalarov's friends Murad and Timur Beniaminov, Roman Beniaminov (no relation), Rob Goldstone, Goldstone and Agalarov's associate Murtaza Akbar, Trump Organization employees Keith Schiller and Michael Cohen, Miss Universe employee Esther Swan, former-Miss Universe Olivia Culpo, and others.","Esther Swan","Murtaza Akbar","neutral2"
"2458","Participants included Trump and his senior Campaign officials, such as Dan Scavino, Hope Hicks, Bannon, Kushner, Stephen Miller, and Jason Miller.","Kushner","Jason Miller","positive2"
"2459","“McMaster wants to send more troops to Afghanistan, so we’re going to send him,” said a triumphal Bannon.","Bannon","McMaster","negative1"
"2460","Because of this confusion, Kaveladze recalled calling Beniaminov on June 7 to find out more information.","Kaveladze","Beniaminov","neutral2"
"2461","Sater told the Committee that he called Shmykov to find a solution.","Sater","Shmykov","neutral2"
"2462","On September 7, the Guccifer 2.0 persona and Nevins traded additional messages over Twitter about the significance of certain materials relating to a ""turnout model.""","Guccifer 2.0","Nevins","neutral2"
"2463","James Comey said Donald Trump could count on James Comey to always tell him the truth.","Donald Trump","James Comey","neutral2"
"2464","Cohen told her that he was working for Trump and that Trump had attended his son’s bar mitzvah.","Cohen","Trump","neutral1"
"2465","“Because Hillary Clinton would be in jail,” Mr Trump shot back.","Trump","Hillary Clinton","negative1"
"2466","Shugart told the Comrnittee that Trump followed up on the Putin meeting whenever they spoke.","Trump","Putin","positive1"
"2467","On October 12, WikiLeaks said: Strongly suggest Donald Trump Jr.'s dad tweets this link if he mentions us ... there's many great stories the press are missing and we're sure some of your follows [sic] will find it. btw we just released Podesta Emails Part 4.","WikiLeaks","Donald Trump Jr.","neutral2"
"2468","On June 17, 2016, Trump sent a personal note of thanks to Emin and Aras Agalarov regarding the painting.","Trump","Aras Agalarov","positive1"
"2469","Cohen, however, linked Sater's renewed outreach to the call with Peskov's aide.","Peskov","Sater","neutral2"
"2470","On October 4, Prince also asked Stone whether Assange had ""chicken[ ed] out.""","Prince","Stone","neutral2"
"2471","Sater recalled ""Evgeny'' telling him that ""[o]f course we'll get Dimitri Peskov.""","Evgeny","Dimitri Peskov","positive1"
"2472","After agreeing to move the time of the meeting back one hour at Goldstone's request, Trump Jr. emailed Kushner and Manafort, forwarding the entirety of his email thread with Goldstone about arranging the meeting.","Trump Jr.","Kushner","neutral2"
"2473","But instead of being shown an early exit, one person in the Trump administration said, Esper could just face an icing out.","Esper","Trump administration","negative2"
"2474","Some evidence suggests that Manafort may have been involved in outreach from the Ukrainian government to the Trump Campaign during this time.","Manafort","the Trump Campaign","neutral2"
"2475","It was the New York Times and the Washington Post, who came to the defense of McMaster, against Breitbart and its cronies and satellites.","New York Times","Breitbart","negative1"
"2476","In September 2015, Sater and Cohen began discussing the possibility of building a Trump Tower in Moscow.","Sater","Cohen","neutral2"
"2477","While in Moscow, we intend to visit and discuss with Michael Cohen the various land plots available suited for construction of this enormous Tower as well as to give Michael Cohen the opportunity to co-ordinate a follow up visit to Moscow by Mr. Donald Trump.","Michael Cohen","Donald","positive1"
"2478","Kilimnik retweeted Stranahan or others restating Stranahan's claims on this theme dozens of times. In January 2019, Kilimnik used his persona's account to send a single direct message to Stranahan.","Kilimnik","Stranahan","positive1"
"2479","Maybe Paul Manafort sent emails, which Oleg never reads.""","Paul Manafort","Oleg","neutral1"
"2480","Because Manafort was initially dubious that Stone had accurate information about WikiLeaks, he instructed Stone ""not to tell Trump until they could. confirm it.""","Manafort","Stone","negative1"
"2481","Michael Cohen, then an executive vice president at the Trump Organization and personal attorney to Trump, primarily handled and pursued these efforts.","Michael Cohen","Trump Organization","neutral1"
"2482","On May 17, 2017, Acting Attorney General Rod Rosenstein appointed the Special Counsel and authorized him to conduct the investigation that Comey had confirmed in his congressional testimony, as well as matters arising directly from the investigation, and any other matters within the scope of 28 C.F.R. � 600.4(a), which generally covers efforts to interfere with or obstruct the investigation.","Rod Rosenstein","Special Counsel","positive1"
"2483","Gates also sent the press release announcing Manafort's joining the Trump Campaign so it could be translated by Kilimnik, and provided as an attachment to each of the four memoranda.","Manafort","the Trump Campaign","neutral1"
"2484","Rinat Akhmetshin said: 'Could Natalia Veselnitskaya show us how the money goes to Hillary's campaign?""'","Rinat Akhmetshin","Natalia Veselnitskaya","neutral1"
"2485","Sater used his ""connections with several high-ranking Russian military or former military and KGB officers"" as the source for the information he provided to the U.S. Government, including much of the information described above.","Sater","U.S. Government","positive1"
"2486","The following day, Shugart recalled seeing reports regarding the hack of the DNC and connected the news with what Goldstone had said at their meeting the day before.","Goldstone","Shugart","neutral2"
"2487","Rykov and members of his network have been involved in efforts targeting the United States and elsewhere.","Rykov","United States","negative1"
"2488","Manafort provided false and misleading information about the purpose, content, and follow-up to the meeting with Oganov to both the Committee and the SCO.","Manafort","Oganov","neutral2"
"2489","She recalled, ""Donald wanted to meet Putin,"" and that, ""He wanted to make sure we arranged a meeting.""","Donald","Putin","positive1"
"2490","Sater recalled that after bringing the proposal to Cohen, Cohen sought and obtained approval from Trump to initiate the negotiations.","Cohen","Trump","positive2"
"2491","According to Cohen, Ivanka Trump also forwarded the initial outreach from Klokov's wife.","Klokov's wife","Ivanka Trump","neutral2"
"2492","Irakly “Ike” Kaveladze is being greeted by lvanka Trump.","lvanka Trump","Irakly “Ike” Kaveladze","neutral1"
"2493","Other Russian government actors and WikiLeaks bolstered Guccifer 2.0's efforts to direct attention away from Russian responsibility.","Russia","Guccifer 2.0","positive1"
"2494","On June 13, 2016, Sater forwarded Cohen a formal electronic invitation to SPIEF addressed to Cohen, along with login instructions to access information about the confetence.","Sater","Cohen","neutral2"
"2495","A gentleman named Anatoli Samochornov.","Natalia Veselnitskaya","Anatoli Samochornov","neutral1"
"2496","Yet, when asked in an ABC News interview to explain the roots of his loyalty, Michael Cohen said, “Michael Cohen does not know the answer.”","Michael Cohen","ABC News","neutral2"
"2497","Fall 2016. On October 7, 2016, the U.S. media released a video of candidate Trump speaking in graphic terms about women years earlier, which was considered damaging to his candidacy.","U.S. media","Trump","negative1"
"2498","Cohn has mainly been battling with two top Trump officials with a protectionist stance on trade — adviser Peter Navarro and Commerce Secretary Wilbur Ross — and had reportedly threatened to resign if Trump sided with them on the tariffs.","Peter Navarro","Trump","neutral1"
"2499","After the election, Cohen was part of an alleged joint defense agreement (JDA) with an unknown number of other Trump-affiliated individuals, including Trump himself, the Trump Organization, Jared Kushner, Ivanka Trump, Felix Sater, and others.","Trump Organization","Felix Sater","positive2"
"2500","The first form of Russian election influence came principally from the Internet Research Agency, LLC (IRA), a Russian organization funded by Yevgeniy Viktorovich Prigozhin and companies he controlled, including Concord Management and Consulting LLC and Concord Catering (collectively ""Concord"").","Yevgeniy Viktorovich Prigozhin","IRA","positive2"
"2501","FBI technical analysis of Papadopoulos's cell phone indicates that Mifsud sent Papadopoulos a text message on March 22, 2016, writing: ""My number: joseph'.""","Mifsud","Papadopoulos","neutral2"
"2502","The next morning, August 1, Stone again spoke twice with Trump.1555 Stone later informed Gates of these calls.","Stone","Gates","neutral2"
"2503","Konstantin Kosachev was sanctioned by the United States in 2018.","United States","Konstantin Kosachev","negative1"
"2504","Kaveladze recalled that, as the group was leaving the conference room, they ran into Ivanka Trump by chance: ""We walk out into reception area.","Kaveladze","Ivanka Trump","neutral2"
"2505","On August 30, Stone and Corsi agreed to fabricate a story that Stone's knowledge and his August 21 Podesta tweet were both based on a public article and subsequent memorandum from Corsi.","Stone","Corsi","positive2"
"2506","Gates and Kilimnik conducted a number of subsequent phone calls, including at 10:25 p.m. for approximately eight minutes, 10:40 p.m. for approximately three minutes, and 11 :27 p.m. for approximately two minutes.","Gates","Kilimnik","neutral2"
"2507","Natalia Veselnitskaya told the Committee, ""In one of those conversations with some other client of Natalia Veselnitskaya -the name of the other client was Mr. Aras Agalarov-he mentioned, he said: Well, let's try.""","Aras Agalarov","Natalia Veselnitskaya","neutral2"
"2508","Papadopoulos engaged both Polonskaya and Timofeev, along with Mifsud, as part of his outreach to Russia.","Papadopoulos","Russia","positive1"
"2509","However, Cohen would later admit that several days after his initial email, on January 20, 2016, he received a response from Elena Poliakova, Peskov's Chief of Staff.","Elena Poliakova","Cohen","neutral2"
"2510","For example, Sater acquired satellite phone numbers associated with Usama Bin Laden and information on Bin Laden's whereabouts following September 11, 2001; the whereabouts of then-Taliban leader Mullah Omar; al-Qa'ida's internal structuring and financial capabilities; and ground reports related to battle damage assessments during Operation Enduring Freedom.","Sater","al-Qa'ida","neutral1"
"2511","Despite Trump's recollection, the Committee assesses that Trump did, in fact, speak with Stone about WikiLeaks and with members of Trump Campaign about Stone's access to WikiLeaks on multiple occasions.","Trump","Trump Campaign","neutral2"
"2512","Morty Levine recalled sitting at the same table as Trump at the bar mitzvah of Michael’s son, Jake.","Morty Levine","Trump","neutral2"
"2513","And mob boss John Gotti, Levine said, hosted a huge Christmas bash in 1988 at the El Caribe.","John Gotti","El Caribe","positive2"
"2514","Nevertheless, Manafort later asserted to the SCO that Kilimnik was not a spy.","Manafort","Kilimnik","positive1"
"2515","In mid-October, Ivanka Trump tasked the Trump Campaign's senior officials (including: Bannon, Scavino, Stephen Miller and Jason Miller) with preparing two Trump tweets every day linking to WikiLeaks content, which, she said, would help ""refocus the narrative.""","Stephen Miller","Trump Campaign","neutral1"
"2516","Manafort, who was not convinced that the documents were coming out, directed Gates to check in with Stone ""from time to time"" to see if his WikiLeaks information remained ""real and viable.""","Manafort","Gates","neutral1"
"2517","Cohen and Sater also made plans for Cohen and Trump to travel to Russia as a predicate to finalizing a deal.","Sater","Trump","neutral1"
"2518","At 4:26 p.m., Kushner sent Manafort a text message, writing only ""Waste of time.""","Kushner","Manafort","neutral2"
"2519","Cohen recalled that in his initial discussion with Trump about Sater's concept for a Trump Tower Moscow, Trump approved moving forward with the project but told Cohen to closely monitor Sater.","Trump","Sater","negative1"
"2520","At10:59 a.m., after. the meeting with Manafort; Kilmnik sent Patten an email on the train"" and that he would be arriving at Washington's Union Station at 2:25 p.m.385 At 5:09 p.m., Gates asked Kilimnik to call him if he had not yet departed on his flight.","Gates","Kilimnik","neutral2"
"2521","Throughout the campaign and following the election, Papadopoulos proffered himself as a conduit between the Trump team and foreign governments, including Russia, Egypt, and Greece.","Papadopoulos","Trump Team","neutral1"
"2522","Emin Agalarov is the son of Aras Agalarov.","Emin Agalarov","Aras Agalarov.","positive2"
"2523","The next morning, Manafort asked Kilimnik how his role with the Trump Campaign could be leveraged to collect the money owed to him by the OB, and whether Deripaska had seen recent press articles relating to Manafort.","Manafort","OB","neutral2"
"2524","Kilimnik and Patten circulated a draft ofthe article in January 2017, which included language suggesting that Ukraine's National Anti-Corruption Bureau (NABU) had ""manufactured a case"" against Manafort","Ukraine's National Anti-Corruption Bureau","Manafort","negative1"
"2525","The ECFMU was secretly backed and funded by the Yanukovych regime and the PoR and reported to Manafort and Andriy Klyuyev, then a senior Ukrainian government official close to Yanukovych.","Yanukovych regime","ECFMU","positive1"
"2526","In the email, Kilimnik explained to Gates that ""these idiots actually admit that PP' s government was deliberately trying to discuss a story on Manafort for which reporters had contacted Lyovochkin for comment.","Kilimnik","Gates","neutral2"
"2527","Republicans, meanwhile, have been growing increasingly restless, with the House Oversight Committee probing Trump’s security protocols for discussing classified information at his weekend retreat in Mar-a-Lago, and Senate majority leader Mitch McConnell suggesting that the Senate investigation of Russian interference in the election would expand.","House Oversight Committee","Trump","negative1"
"2528","Trump Campaign and Russian leadership had a mutual interest in defeating Democratic presidential candidate Hillary Clinton, whom President Putin apparently both hated and feared.","Trump Campaign","Russian leadership","positive2"
"2529","Cheremin's secretary forwarded the plans to an email address that included the name Shutenko, likely affiliated with Oleg Shutenko, Cheremin's deputy in the Moscow city government","Cheremin","Oleg Shutenko","neutral2"
"2530","Patten told the Committee that Kilimnik had relayed a similar explanation for the reference.","Patten","Committee","neutral2"
"2531","Bannon then installed Mark Corallo, a former Karl Rove communications staffer, as the firewall spokesperson.","Bannon","Mark Corallo","positive1"
"2532","In mid-to late-July 2016, Kilimnik appeared to have insider knowledge of the Trump Campaign.","Kilimnik","the Trump Campaign","positive1"
"2533","Veselnitskaya, Samochornov, Akhmetshin, and Kaveladze went briefly to a bar in Trump Tower for a drink.","Akhmetshin","Kaveladze","positive1"
"2534","And he mentioned the adoption again.","Rob Goldstone","Paula Shugart","neutral2"
"2535","Lyovochkin, Yanukovych's former chief of staff, helped lead the consolidation of the OB with the backing of Akhmetov, Yanukovych's longtime sponsor.","Lyovochkin","Yanukovych","neutral2"
"2536","The Committee bases its assessment that Boyarkin is a Russian State intelligence officer on the following information.","Boyarkin","Russian State","neutral1"
"2537","On November 13, Goldstone and Kaveladze exchanged text messages in which Goldstone wrote, ""So it seems we are all now in the Donald Trump's inner circle!!","Kaveladze","Donald Trump","positive2"
"2538","While Trump was Sater's primary point of contact in the Trump Organization, Sater also worked with Donald Trump Jr., Ivanka Trump, and Jason Greenblatt at various times during his efforts.","Sater","Donald Trump","neutral1"
"2539","In text messages with Kaveladze, Veselnitskaya rejected a proposed cafe for a meeting with Balber because there were ""too many ears,"" and advocated for a more private location.","Veselnitskaya","Balber","negative1"
"2540","Three months later, Michael Cohen told ABC News that his family had his “first loyalty and always will.” Later that month, Michael Cohen released the recording he had secretly made of Trump discussing hush-money payments.","Michael Cohen","ABC News","neutral2"
"2541","Martafort claimed that Kilimnik came to Madrid to update him on the work of the National Anti-Corruption Bureau related to the ledger","Kilimnik","Martafort","neutral1"
"2542","The lawyer, Donald McGahn, rebuffed Donald Trump, saying that he had no authority to order a prosecution.","Donald McGahn","Donald Trump","negative1"
"2543","In April 2016, Assange and WikiLeaks criticized the release of information in the Panama Papers as a ""Putin attack [that] was produced by OCCRP which targets Russia & former USSR and was funded by USAID & Soros,"" a frequent refrain in Russian state-sponsored influence operations.","Soros","OCCRP","positive1"
"2544","It was also the case that McMaster was disliked by Donald Trump and on the point of being dismissed.","Donald Trump","McMaster","negative2"
"2545","The data was subsequently leaked by GRU personas and WikiLeaks at strategic moments during the 2016 election, as part of a coordinated hack--and-leak operation intended to damage the Clinton Campaign, help the Trump Campaign (the ""Campaign""), and undermine the U.S. democratic process.","GRU","the Clinton Campaign","negative1"
"2546","Goldstone also recalled, ""I'd said either pre-or post-meeting to Emin, probably Emin, that: 'This is a pretty big favor; I hope it was worth it to your father.","Goldstone","Emin","neutral2"
"2547","Now in a turn of fate, Newsom and the commander-in-chief are working together.","Newsom","commander-in-chief","positive2"
"2548","The first form of Russian election influence came principally from the Internet Research Agency, LLC (IRA), a Russian organization funded by Yevgeniy Viktorovich Prigozhin and companies he controlled, including Concord Management and Consulting LLC and Concord Catering (collectively ""Concord"").","Yevgeniy Viktorovich Prigozhin","Concord Catering","positive1"
"2549","Veselnitskaya has traveled frequently to the United States, in part due to her role representing the Russian businessman Denis Katsyv and his Cyprus-based company Prevezon Holdings.","Veselnitskaya","Denis Katsyv","positive2"
"2550","A spokesman for Donald Trump’s lawyer, Mark Corallo, denied these claims","Mark CORALLO","Donald Trump","neutral1"
"2551","Starting in April 2016, the GRU hacked into the computer networks of the Democratic Congressional Campaign Committee (DCCC) and the Democratic National Committee (DNC).","GRU","DNC","negative1"
"2552","Following the meeting with Yakunin, Rohrabacher, Behrends, and the other members of the delegation met with Konstantin Kosachev, the Chairman of the Council of the Federation Committee on Foreign Affairs.","Yakunin","Rohrabacher","neutral2"
"2553","Manafort in a memorandum at the time described the Orange Revolution and the defeat of Yanukovych as a ""disaster.""","Manafort","Yanukovych","positive1"
"2554","Kaveladze also facilitated an introduction between Veselnitskaya and the Agalarovs' lawyer, Scott Balber.","Scott Balber","Agalarovs","neutral1"
"2555","Deripaska first became involved in Montenegro in a significant way through his purchase of a majority stake in Kombinat Aluminijuma Podgorica (KAP), Montenegro's largest exporter, which at one point was responsible for approximately half of the country's economic output.","Deripaska","Kombinat Aluminijuma Podgorica (KAP)","positive1"
"2556","Gates, who arrived late to the meeting, said that Kilimnik had relayed an ""urgent"" message at the meeting.","Gates","Kilimnik","neutral2"
"2557","Shugart,replied, ""I'll know more in the morning but it sounds serious.","Shugart","Rhona Graff","neutral2"
"2558","On March 24, 2016, Papadopoulos met with Mifsud and Olga Polonskaya, a Russian-national, at the Holborn Hotel.","Papadopoulos","Mifsud","neutral2"
"2559","According to Beniaminov, attendees at the dinner included Aras Agalarov, Donald Trump, Aras Agalarov's wife and daughter, Emin Agalarov, Emin Agalarov's friends Murad and Timur Beniaminov, Roman Beniaminov (no relation), Rob Goldstone, Goldstone and Agalarov's associate Murtaza Akbar, Trump Organization employees Keith Schiller and Michael Cohen, Miss Universe employee Esther Swan, former-Miss Universe Olivia Culpo, and others.","Murtaza Akbar","Agalarov Family","neutral1"
"2560","The following day there was a dress rehearsal and the Miss USA pageant at which Aras Agalarov and Emin Agalarov sat beside Trump.","Emin Agalarov","Trump","positive2"
"2561","Cohen recalled that he and Sater continued to have ""many"" conversations and that he had pressed Sater to identify a property for the project.","Cohen","Sater","neutral1"
"2562","Papadopoulos said yes.","Papadopoulos","Trump Campaign","neutral2"
"2563","The prospect of Cohen betraying Trump seemed unthinkable during the presidential race, when he served as a reliably combative surrogate.","Cohen","Trump","negative2"
"2564","Ultimately, two IRA employees-Anna Bogacheva and Aleksandra Krylova-received visas and entered the United States on June 4, 2014.","Aleksandra Krylova","IRA","neutral1"
"2565","The following day, October 30, Graff wrote to Shugart, ""Any news on Putin?""","Graff","Putin","neutral1"
"2566","Graff confirmed that the book and letter were received, and apologized for the delay in responsiveness due to it being an unusual time.·","Graff","Rob Goldstone","positive1"
"2567","It was at that point, for the first time, that Goldstone told Shugart that Manafort and Kushner had participated, as well as Veselnitskaya, and Goldstone described the focus on Browder, who he had not mentioned previously.","Kushner","Veselnitskaya","neutral2"
"2568","Nastya Rybka's arrest also apparently attracted the attention of Deripaska and his business associates.","Nastya Rybka","Deripaska","neutral1"
"2569","At first, Michael Cohen appeared indifferent as he listened to the group of Republican leaders urge Donald Trump to run for governor.","Michael Cohen","Donald Trump","neutral1"
"2570","In September 2017, Kilimnik shared a letter with Patten that Lyovochkin and his OB associates drafted allegedly on behalf of Oleksandr Lavrynovych.","Kilimnik","Patten","neutral1"
"2571","Lyovochkin, Yanukovych's former chief of staff, helped lead the consolidation of the Opposition Bloc OB with the backing of Akhmetov, Yanukovych's longtime sponsor.","Lyovochkin","Opposition Bloc OB","positive1"
"2572","Once, during a dinner with Cohen and his wife, Laura, Freidman said Cohen bragged that he had pushed aside the doctor during their son’s birth and delivered the baby himself, a claim that Laura, at the table that night, dismissed as untrue.","Laura","Freidman","neutral2"
"2573","On September 24, 2015, Rtskhiladze emailed Cohen a draft document in Russian.","Rtskhiladze","Cohen","neutral2"
"2574","Kaveladze recalled that Aras Agalarov was initially very skeptical about hosting the pageant, but Emin Agalarov was excited and lobbied his father.","Emin Agalarov","Aras Agalarov","positive1"
"2575","On August 9, Assange gave an interview on Dutch television implying that Rich was the source of the DNC emails, and that day WikiLeaks announced that it would be issuing a reward for information about Rich's murder.","Assange","Rich","positive1"
"2576","In May 2016, IRA employees, claiming to be U.S. social activists and administrators ofFacebook groups, recruited U.S. persons to hold signs (including one in front of the White House) that read ""Happy 55th Birthday Dear Boss,"" as an homage to Prigozhin whose 55th birthday was on June 1, 2016","IRA","Prigozhin","positive1"
