"","sentence","head","tail","relation"
"2577","The Committee found that Manafort's presence on the Campaign and proximity to Trump created opportunities for the Russian intelligence services to exert influence over, and acquire confidential information on, the Trump Campaign.","Russian intelligence services","the Trump Campaign","negative1"
"2578","As noted, Gates understood that Kilimnik would share the polling data with Ukrainian oligarchs affiliated with the OB and with Deripaska.","Kilimnik","Deripaska","positive1"
"2579","One narrative from Assange involved a conspiracy theory that Seth Rich, a DNC staffer killed in a botched robbery, was the source of the DNC ·email leak and had been murdered in response.","Seth Rich","WikiLeaks","positive1"
"2580","As outlined in his indictment and presented at trial, in subsequent congressional testimony to the HPSCI, Stone hid his communications with Corsi about WikiLeaks, and instead identified Credico as his intermediary; he also concealed communications he made directing both Corsi and Credico to obtain advance information about future WikiLeaks releases; and he made misleading and false statements about his communications with the Trump Campaign and individuals associated with the Campaign.","Stone","the Trump Campaign","neutral2"
"2581","According to an FBI interview of Gates, Alexander and Dmit Chera were the owners of Black Sea Cable affiliated with Rinat Akhmetov","Dmit Chera","Black Sea Cable","neutral1"
"2582","Sater explained that he pursued a large number of international deals which he pitched to Trump and the Trump Organization.","Sater","the Trump Organization","neutral1"
"2583","And when he won, not only would another grievously stupid chapter in the war in Afghanistan be avoided, but Jarvanka, and Powell, their factotum, would be further consigned to irrelevance and powerlessness.","Powell","Jarvanka","neutral1"
"2584","In addition, Trump publicly requested that Russia find and release the ""missing"" emails from Clinton's server, and hours later, GRU hackers attempted new spear phishing attacks against the Clinton Campaign.","Trump","Russia","neutral1"
"2585","Powell even helped design a PowerPoint deck that McMaster began using with the president: pictures of Kabul in the 1970s when it still looked something like a modern city.","Powell","McMaster","positive2"
"2586","According to Beniaminov, attendees at the dinner included Aras Agalarov, Donald Trump, Aras Agalarov's wife and daughter, Emin Agalarov, Emin Agalarov's friends Murad and Timur Beniaminov, Roman Beniaminov (no relation), Rob Goldstone, Goldstone and Agalarov's associate Murtaza Akbar, Trump Organization employees Keith Schiller and Michael Cohen, Miss Universe employee Esther Swan, former-Miss Universe Olivia Culpo, and others.","Murtaza Akbar","Donald Trump","neutral2"
"2587","On Thursday, November 7, Donald Trump was scheduled to attend Billy Graham's birthday in North Carolina with Melania Trump.","Donald Trump","Billy Graham","positive2"
"2588","Manafort also stayed in touch with Kilimnik; and Kilimnik was aware of Manafort is continuing communications with the Trump Campaign.","Manafort","Trump Campaign","positive2"
"2589","Veselnitskaya, who was on a phone call, handed Samochomov one of her phones and asked him to translate and transcribe a text message, which she dictated, asking that Akhmetshin be added to the meeting.","Veselnitskaya","Samochomov","neutral1"
"2590","Separately, Bob Foresman, an American businessman living in Moscow who sought a position in the Trump Administration, conveyed brief messages between the Trump Campaign and several Kremlin-linked individuals, including Putin confidant Matthias Warnig, and provided other information relating to the U.S.-Russia relationship during the Transition.","Bob Foresman","Trump Administration","positive1"
"2591","Her colleague Alexander Kirillov allegedly requested, in a letter to the American consulate, political asylum for those arrested with Rybka.","Alexander Kirillov","the American consulate","neutral1"
"2592","With Gates's help, Manafort was involved in outreach from the Ukrainian Embassy in the United States to the Trump Campaign in September 2016.","Gates","Manafort","positive2"
"2593","Later on June 24, Shugart responded to Graffs email, writing, ""I have no idea, I'm finding out now.""","Shugart","Graff","neutral1"
"2594","Donald Trump wants to personally invite Vladimir Putin as his guest of honor to the November 9th Miss Universe Pageant, and would also hope to meet privately with him during Donald Trump's stay in Moscow.""","Donald Trump","Vladimir Putin","positive1"
"2595","The GRU spearphishing operation enabled it to gain access to numerous email accounts of Clinton Campaign employees and volunteers, including campaign chairman John Podesta, junior volunteers assigned to the Clinton Campaign's advance team, informal Clinton Campaign advisors, and a DNC employee.","GRU","Clinton Campaign","negative1"
"2596","Veselnitskaya recalled that Trump Jr., ""asked a clarifying question, whether I had the financial records indicating that the particular funds that were obtained . . . in the United States were transferred directly to Clinton Foundation.""","Trump Jr.","Veselnitskaya","neutral1"
"2597","The investigation also identified numerous links between the Russian government and the Trump Campaign.","Russian government","Trump campaign","neutral2"
"2598","Bannon wrote in the July 2017 email that Kushner “was on ‘vacation’ off the coast of Croatia with a Russian billionaire when I took over the Trump Campaign.”","Bannon","Trump Campaign","positive1"
"2599","He said: Sure.","Michael Cohen","Felix Sater","neutral2"
"2600","And when Steve Bannon won, not only would another grievously stupid chapter in the war in Afghanistan be avoided, but Jarvanka, and Powell, their factotum, would be further consigned to irrelevance and powerlessness.","Steve Bannon","Jarvanka","negative1"
"4401","Reince Priebus had to break up one impromptu meeting of Trump and his Homeland Security adviser after an aide asked the chief if there had been a change to the schedule.","Reince Priebus","Homeland Security adviser","negative1"
"4402","The message came from Yanukovych and asked whether Manafort would run Yanukovych' s comeback campaign","Yanukovych","Manafor","neutral2"
"4403","The article discussed Ukrainian politicians aligned with Poroshenko's political party who had reversed course after Trump's victory and were now accusing Leshchenko of ""falsifying evidence'' in a Ukrainian criminal case related to Manafort","Leshchenko","Manafort","negative1"
"4404","According to Cohen, Trump instructed Cohen to speak with then-campaign manager Corey Lewandowski about dates for potential travel to Russia.","Trump","Cohen","neutral2"
"4405","While serving on the Trump Campaign, Manafort, often with the assistance of Gates, engaged with individuals inside Russia and Ukraine on matters pertaining to both his personal business prospects and the 2016 U.S. presidential election.","Gates","Manafort","positive1"
"4406","Trump’s first campaign manager and the head of his transition project were each ousted when they questioned the calls of Trump’s son-in-law turned senior adviser, Jared Kushner.","Trump","Jared Kushner","neutral1"
"4407","Manafort asked John Dowd, then a lead attorney for Trump, if Manafort and Gates were eligible for money from this fund.","Manafort","John Dowd","neutral2"
"4408","“Morty Levine should hate Donald Trump because he screwed Michael Cohen.","Donald Trump","Michael Cohen","negative1"
"4409","The Special Counsel's Office cannot rule out that stolen documents were transferred to WikiLeaks through intermediaries who visited during the summer of 2016.","Special Counsel's Office","WikiLeaks","negative1"
"4410","But Cohen surprised Caputo by talking about his own political aspirations.","Cohen","Caputo","neutral1"
"4411","Rob is Aras Agalarov's rep in the US and sent this on.","Rob","Aras Agalarov","positive2"
"4412","According to Beniaminov, attendees at the dinner included Aras Agalarov, Donald Trump, Aras Agalarov's wife and daughter, Emin Agalarov, Emin Agalarov's friends Murad and Timur Beniaminov, Roman Beniaminov (no relation), Rob Goldstone, Goldstone and Agalarov's associate Murtaza Akbar, Trump Organization employees Keith Schiller and Michael Cohen, Miss Universe employee Esther Swan, former-Miss Universe Olivia Culpo, and others.","Esther Swan","Olivia Culpo","neutral2"
"4413","During subsequent communications, the Guccifer 2.0 persona informed DCLeaks that WikiLeaks was trying to contact DCLeaks and arrange for a way to speak through encrypted emails","Guccifer 2.0","DCLeaks","neutral2"
"4414","IRA employees monitored the reaction of the Trump Campaign and, later, Trump Administration officials to their tweets.","IRA","Trump Administration","neutral1"
"4415","According to Rob Goldstone, who later served as Emin Agalarov' s promoter and aide, there was ""too much red tape,"" making bringing the Miss Universe pageant to Moscow ""too difficult to do.""","Rob Goldstone","Emin Agalarov","neutral1"
"4416","Starting in likely late 2004, Konstantin Kilimnik began to work for Manafort in Ukraine and elsewhere on Deripaska-related projects.","Konstantin Kilimnik","Deripaska","neutral1"
"4417","The IRA was based in St. Petersburg, Russia, and received funding from Russian oligarch Evgeny Prigozhin and companies he controlled.","Evgeny Prigozhin","IRA","positive1"
"4418","The four-page letter went on to critique Comey's judgment and conduct, including his May 3 testimony before the Senate Judiciary Committee, his handling of the Clinton email investigation, and his failure to hold leakers accountable.","Donald Trump","Comey","negative1"
"4419","Donald Trump greatly appreciates Emin Agalarov and Aras Agalarov's friendship-- this is one birthday that Donald Trump will always remember.","Donald Trump","Aras Agalarov","positive2"
"4420","For example, in approximately 2006, Sater recalled traveling to Russia on Trump' s request because both Ivanka Trump and Donald Trump Jr. would be traveling there, in part to research potential deals.","Sater","Ivanka Trump","neutral1"
"4421","Kaveladze also facilitated an introduction between Veselnitskaya and the Agalarovs' lawyer, Scott Balber.","Veselnitskaya","Scott Balber","neutral2"
"4422","In Bannon’s scenario, Trump would give McMaster a fourth star and “promote” him to top military commander in Afghanistan.","Trump","McMaster","negative1"
"4423","Gerson and Dmitriev constructed a five-point plan on how to improve relations between Russia and the U.S. and presented it to the Transition Team and the Kremlin, respectively.","Dmitriev","the Kremlin","neutral1"
"4424","Donald Trump has accused Mr Comey, without evidence, of illegally having classified information shared with The New York Times in a memo that Mr Comey wrote about his interactions with Donald Trump.","Comey","Donald Trump","neutral2"
"4425","Papadopoulos's wife, Mangiante, told the Committee that Papadopoulos thought Polonskaya was President Putin's niece because of the way Mifsud introduced her to Papadopoulos.","Polonskaya","Putin","positive2"
"4426","Chrysostomides and his companies assisted Manafort and Deripaska in setting up loans to disguise income in Cypriot businesses and avoid Cypriot taxes; these efforts included Pericles.","Chrysostomides","Manafort","positive1"
"4427","The same day as the Family Meeting, Emin Agalarov emailed Goldstone, asking if there was ""any news"" related to a possible call with Trump Jr.","Emin Agalarov","Trump Jr.","neutral2"
"4428","Documents show that Manafort worked for Yanukovych and the PoR at times unrelated to election campaigns and formed a continuous relationship with the PoR and Yanukovych.","Manafort","the PoR","neutral1"
"4429","Donald Trump asked James Comey to end the bureau’s investigation into Mr. Flynn","Donald Trump","James Comey","neutral2"
"4430","Candidate Trump signed a Letter of lntent for Trump Tower Moscow by November 2015, and in January 2016 Trump Organization executive Michael Cohen emailed and spoke about the project with the office of Russian government press secretary Dmitry Peskov.","Michael Cohen","Trump Organization","neutral1"
"4431","On the same day, March 24, 2016, almost certainly after his meeting with Mifsud and Polonskaya, Papadopoulos performed internet searches for the following terms:","Papadopoulos","Polonskaya","neutral2"
"4432","At the time, Sater was in Russia working on a business deal to rent a transatlantic cable from AT&T.","Sater","AT&T","neutral1"
"4433","Later that day, Donald Trump tweeted a link to Emin Agalarov's video.","Donald Trump","Emin Agalarov","positive1"
"4434","He ordered White House press secretary Sean Spicer to conduct his first press briefing as a frothing attack dog.","Sean Spicer","White House","neutral1"
"4435","Manafort briefed Kilimnik on sensitive Campaign polling data and the Campaign's strategy for beating Hillary Clinton.","Manafort","Kilimnik","neutral2"
"4436","Sergey Aleksashenko is a former deputy chairman of the Russian central bank and a former chairman of Merrill Lynch Russia","Sergey ALEKSASHENKO","Russian Central Bank","neutral1"
"4437","Committee believes that he knew Kilimnik and Manafort ""were in contact"" in the period prior to the announcement, although he was not aware any specific communication relaying this information to Kilimnik.","Kilimnik","Manafort","neutral2"
"4438","“He wished he was in ‘Goodfellas,’” said Greg Ehrlich, whose wedding Cohen attended in the early 2000s.","Greg Ehrlich","Cohen","positive2"
"4439","On September 18, Stone texted Credico that he was ""e-mailing u a request to pass on to [A]ssange.""","Stone","Credico","neutral2"
"4440","Volume I describes the factual results of the Special Counsel's investigation of Russian Government's interference in the 2016 presidential election and its interactions with the Trump Campaign.","Russian Government","Trump Campaign","neutral2"
"4441","According to Mangiante, she was introduced to Mifsud at some point between 2009 and 2016 through Gianni Pittella, the former head of a political group within the European Union.","Gianni Pittella","European Union","neutral1"
"4442","Thereafter, Trump directed Trump Campaign officials to stay in touch with Roger Stone about future WikiLeaks activities regarding Clinton-related emails.","Trump Campaign","Roger Stone","neutral2"
"4443","On September 20, 2016, an individual named Jason Fishbein sent WikiLeaks the password for an unlaunched website focused on Trump's ""unprecedented and dangerous"" ties to Russia, PutinTrump.org","Trump","Russia","neutral2"
"4444","That evening, Patten, Kilimnik, Lyovochkin, and a pollster who had worked with Kilimnik and Patten in Ukraine had dinner together.","Kilimnik","Lyovochkin","positive2"
"4445","The investigation also established that the Trump Campaign displayed interest in the WikiLeaks releases, and that []","Trump Campaign","WikiLeaks","positive1"
"4446","Kilimnik also worked to conduct messaging to U.S. Government officials and the media to undercut other Ukrainian government investigations related to Manafort.","Kilimnik","Manafort","positive1"
"4447","Sater explained that he subsequently ""spoke to [Molchanov] on a number of occasions"" about the Trump deal.","Sater","Molchanov","neutral2"
"4448","The article quoted ""a former Yanukovich loyalist now playing a lead role in the Regions party's successor, called Opposition Bloc"" who, according to the article, ""let loose a string of expletives"" and ""accused Western media of ' working in the interests of Hillary Clinton by trying to bring down Trump. ""","Western Media","Trump","negative1"
"4449","Once, during a dinner with Cohen and his wife, Laura, Freidman said Cohen bragged that he had pushed aside the doctor during their son’s birth and delivered the baby himself, a claim that Laura, at the table that night, dismissed as untrue.","Cohen","Laura","positive2"
"4450","After the start ofthe proceeding in the Cayman Islands, Adam Waldman, Deripaska's U.S.-based lawyer, told the Committee that in approximately March 2015, Deripaska asked him to ""look into"" the Pericles matter, Waldman recalled that he sought to locate Manafort, which ""took some doing.”","Adam Waldman","Manafort","neutral1"
"4451","She wrote, ""I am very excited about our collaboration and am confident that our families will enjoy great success together.","Ivanka Trump","Emin Agalarov","positive1"
"4452","During Cohen's initial interview, Cohen's then-counsel Stephen Ryan told the Committee that Cohen was not involved in the production of documents to the Committee.","Stephen Ryan","Cohen","positive1"
"4453","Chrysostomides used his company, Dr. K. Chrysostomides & Co LLC (DKCC) to create at least three shell companies on behalf of Manafort, Gates, and Deripaska-Lucile Consultants Limited, Bletilla Ventures Limited, and Yiakora Ventures Limited-all registered to 1 Lampousas Street, 1095 Nicosia, Cyprus.","Gates","Yiakora Ventures Limited","neutral2"
"4454","Despite Trump's recollection, the Committee assesses that Trump did, in fact, speak with Stone about WikiLeaks and with members of his Campaign about Stone's access to WikiLeaks on multiple occasions.","Trump","Stone","neutral2"
"4455","On October 3, 2016, WikiLeaks sent another direct message to Trump Jr., asking ""you guys"" to help disseminate a link alleging candidate Clinton had advocated using a drone to target Julian Assange.","WikiLeaks","Trump Jr.","neutral1"
"4456","Any of these calls would have provided Stone with an opportunity to share additional information about WikiLeaks directly with Trump, and given the content of his conversations with Manafort and Gates combined with Trump's known interest in the issue, the Committee assesses he likely did.","Stone","Manafort","neutral2"
"4457","Flynn declared that he had had no such conversations, absolutely no conversation, he confirmed again, and the interview, attended by Karen DeYoung and senior National Security Council official and spokesman Michael Anton, ended soon thereafter.","Karen DeYoung","Michael Anton","neutral2"
"4458","Patten recalled conducting at least one poll with Kilimnik in 2017 as part of their ongoing work for the OB","Patten","OB","neutral1"
"4459","By early November 2015, Trump and Rozov co-signed the LOI.","Trump","Rozov","neutral2"
"4460","In the statements, DNC's cyber-response team alleged that Russian Government -sponsored actors (which they referred to as ""Fancy Bear"") were responsible for the breach.","DNC","Russian Government","negative2"
"4461","President Donald Trump on Sunday would not say whether he will pardon several former associates who were convicted after being charged as part of the Mueller probe, including former campaign chairman Paul Manafort and long-time friend Roger Stone.","Mueller","Roger Stone","negative2"
"4462","Samochomov told the Committee: Then Mr. Akhmetshin took the floor and [in English] he talked about HRAGI [ ] and the fact that there is this chance.","Akhmetshin","HRAGI","positive1"
"4463","The following day, October 30, Graff wrote to Shugart, ""Any news on Putin?""","Graff","Shugart","neutral2"
"4464","While the GRU and WikiLeaks were coordinating the release of hacked DNC, DCCC, and Podesta documents, Trump and senior Campaign officials sought information relating to ""missing"" Hillary Clinton emails as part of the Campaign's opposition research and press strategies.","WikiLeaks","Podesta","negative1"
"4465","Since that time, Deripaska has sought to control the Montenegrin government and influence its policies toward Kremlin-aligned objectives","Deripaska","Kremlin","positive2"
"4466","According to Manafort, Kilimnik had been putting together background information on the status of inquiries by reporters and investigators about Manafort's activities in Kyiv, at Manafort's request.","Kilimnik","Manafort","neutral2"
"4467","Cohen responded to Sater the following day, stating, ""[w]orks for me.""","Cohen","Sater","neutral2"
"4468","And Irakly “Ike” Kaveladze looked at Goldstone and he goes: 'You don't need to leave; just sit, and you'll take them out at the end,""' and Goldstone agreed.","Irakly “Ike” Kaveladze","Goldstone","neutral2"
"4469","In this, the comms team was judged to be antagonistic if not hostile to the interests of Jared and Ivanka; Spicer and his people had failed to mount an inclusive defense for them, nor had the comms team adequately defended the White House.","comms team","Jared","negative2"
"4470","This is in contrast to what Clovis stated in his interview with the Committee, during which he stated, ""I think my advice to George [Papadopoulos] has always been: No to Russia.""","Clovis","Papadopoulos","neutral2"
"4471","A work proposal describes Kilimnik as having ""managed successful political operations for Ukraine's ruling party, prime minister and Ukraine's president from 2005-2014,” and having worked as a ""senior member of campaign team for successful referendum for independence in Montenegro in 2006 and several other parliamentary and presidential campaigns."");","Kilimnik","Ukraine's president","neutral2"
"4472","Kaveladze said that, on June 7, he strongly suggested to Aras Agalarov, again, that they meet with Donald Trump's attorneys, rather than the Campaign leadership, but he did not raise the derogatory information regarding Hillary Clinton.","Kaveladze","Aras Agalarov","neutral1"
"4473","But tensions and suspicions mounted, especially after the two most important political advisers in DeSantis’ orbit — chief of staff Shane Strum and his wife, Casey DeSantis — went to Florida GOP headquarters in Tallahassee in April 2019.","DeSantis","Shane Strum","positive2"
"4474","Beginning in March 2016, officers of the Russian Main Intelligence Directorate, the GRU, successfully hacked computer networks belonging to the Democratic National Committee (DNC) and the Democratic Congressional Campaign Committee (DCCC), and the email accounts of Clinton Campaign officials and employees, including Campaign Chairman, John Podesta.","GRU","Democratic National Committee","negative1"
"4475","Following Ivanka Trump's visit to Crocus on February 4, she emailed Emin Agalarov to thank him for the tour.","Ivanka Trump","Emin Agalarov","positive1"
"4476","Shugart told the Committee that she understood Goldstone to be discussing meeting with Dmitry Peskov.","Goldstone","Dmitry Peskov","positive1"
"4477","Aras Agalarov, Emin's father, expressed concern that DT would only be in on November 8th.","Aras Agalarov","Emin","positive2"
"4478","Barrack attached to the email both of Manafort's previous memoranda to him, totaling five pages.","Barrack","Donald Trump","neutral2"
"4479","But Trump said Tuesday during a joint press conference with Swedish Prime Minister Stefan Lofven that people love working in the White House because it's got ""tremendous energy,"" though some people ""change.""","Stefan Lofven","Trump","neutral2"
"4480","Stone returned the call to Schiller at 1:51 p.m. for three minutes.","Stone","Schiller","neutral2"
"4481","Manafort eventually admitted to reading a foldered email from Kilimnik describing the plan and steps for its implementation in December 2016.","Manafort","Kilimnik","neutral2"
"4482","Manafort stated that he told Kilimnik the plan was crazy and that ended the discussion","Manafort","Kilimnik","neutral2"
"4483","To underscore his point, Mr McGahn had White House lawyers write a memo for Mr Trump warning that if he asked law enforcement to investigate his rivals, he could face a range of consequences, including possible impeachment.","McGahn","Trump","negative1"
"4484","That previous influence effort occurred in Moscow in April 2016, months prior to the June 9, 2016 meeting, when then U.S. Congressman Dana Rohrabacher was provided a folder of information from the Russian government that was largely similar in content to what Veselnitskaya later used in Trump Tower.","Dana Rohrabacher","U.S.","neutral2"
"4485","Tropea responded, ""We can consider that relationship done[.]""","Tropea","Rob Goldstone","neutral2"
"4486","For example, in early 2016, Vasiliy Anisimov, a Russian oligarch with ties to Vladimir Putin and ties to organized crime, sought to hire Louis Freeh, an American lobbyist and former Director of the FBI, to work with Veselnitskaya on the Prevezon case.","Louis Freeh","FBI","positive2"
"4487","Trump's written responses to questions from the SCO state, ""I have no recollection of learning at the time that Donald Trump Jr., Paul Manafort, or Jared Kushner was considering participating in a meeting in June 2016 concerning potentially negative information about Hillary Clinton.""","Paul Manafort","Hillary Clinton","negative1"
"4488","While this account is generally supported by documents provided to the Committee, it does not fully capture the extent to which Aras Agalarov and Veselnitskaya pushed for the meeting.","Veselnitskaya","Donald Trump","positive1"
"4489","Veselnitskaya has traveled frequently to the United States, in part due to her role representing the Russian businessman Denis Katsyv and his Cyprus-based company Prevezon Holdings.","Veselnitskaya","Prevezon Holdings","positive2"
"4490","After checking in at his hotel, Rinat Akhmetshin remembered receiving a call from Veselnitskaya asking Rinat Akhmetshin to join her for lunch.","Veselnitskaya","Rinat Akhmetshin","positive1"
"4491","Trump and the Campaign believed that Stone had inside information and expressed satisfaction that Stone's information suggested more releases would be forthcoming.","Trump","Stone","positive1"
"4492","Though the records obtained by the Committee are limited, they show numerous phone calls throughout June and July between Trump and Stone.","Trump","Stone","neutral2"
