"","sentence","head","tail","relation"
"3026","Manafort continued working with Kilimnik on the plan, including efforts to draft a poll to test aspects of the plan as late as 2018.","Manafort","Kilimnik","positive2"
"3027","Veselnitskaya also told the Committee that she represents Aras Agalarov on some issues, and has worked for him since 2013 or 2014.","Veselnitskaya","Aras Agalarov","positive2"
"3028","Sater later explained to the Committee that Emin Iskenderov, a Russian developer known for his efforts to develop a multi-billion dollar project in Paris, ""had access"" to Peskov.","Emin Iskenderov","Peskov","neutral1"
"3029","At Cohen's request, Rtskhiladze provided a translation of the draft letter.","Rtskhiladze","Cohen","neutral2"
"3030","However, on several occasions, the Campaign asked him to stop his interactions with the foreign press on its behalf, and in October 2016, several senior Campaign staffers discussed ending Papadopoulo+E136s's role with the Campaign, but never did so.","George Papadopoulos","Joseph Mifsud","neutral2"
"3031","For example, Nastya Rybka, a former Deripaska mistress, was arrested in Thailand and claimed that she was ""the only witness and the missing link in the connection between Russia and the U.S. elections - the long chain of Oleg Deripaska, Prikhodko, Manafort, and Trump.""","Deripaska","Prikhodko","positive2"
"3032","Julian Assange has said that he focuses his efforts on the United States because it is the world's ""superpower.""","Julian Assange","United States","negative1"
"3033","And Felix Sater flew there from Europe, because Felix Sater didn't fly there with Donald Trump Jr. and Ivanka Trump, and Felix Sater met them there.","Donald Trump Jr.","Ivanka Trump","neutral2"
"3034","In an interview with Aras Agalarov that has only partially been published, Agalarov was asked why Putin wanted to meet with Trump.","Putin","Trump","positive1"
"3035","Republicans, meanwhile, have been growing increasingly restless, with the House Oversight Committee probing Trump’s security protocols for discussing classified information at his weekend retreat in Mar-a-Lago, and Senate majority leader Mitch McConnell suggesting that the Senate investigation of Russian interference in the election would expand.","Mitch McConnell","Senate","neutral2"
"3036","WikiLeaks began releasing Podesta' s stolen emails on October 7, 2016, less than one hour after a U.S. media outlet released video considered damaging to candidate Trump.","U.S. media","Trump","negative1"
"3037","Steve Bannon’s off-balance-sheet communications staff—Bossie, Lewandowski, Jason Miller, Sam Nunberg (even though he had long fallen out with Trump himself), and Alexandra Preate—formed quite a private army of leakers and defenders.","Steve Bannon","Jason Miller","positive2"
"3038","Stone responded, echoing information he had received from Credico and Assange's own announcement:","Stone","Steve Bannon","neutral2"
"3039","Some evidence suggests Kilimnik may be connected to the GRU hack-and-leak operation related to the 2016 U.S. election.","Kilimnik","GRU","neutral1"
"3040","WikiLeaks publicly tweeted: '""Let's bomb Iraq' Progress for America PAC to launch ""PutinTrump.org' at 9:30am. Oops pw is 'putintrump' putintrump.org.""","Progress for America","PutinTrump.org","neutral2"
"3041","At the same time that the IRA operation began to focus on supporting candidate Trump in early 2016, the Russian government employed a second form of interference: cyber intrusions (hacking) and releases of hacked materials damaging to the Clinton Campaign.","IRA","Clinton campaign","negative1"
"3042","Stone then emailed Jessica Macchia, one of Trump's assistants, eight draft tweets for Trump, under the subject line ""Tweets Mr. Trump requested last night.""","Stone","Jessica Macchia","neutral1"
"3043","According to Beniaminov, attendees at the dinner included Aras Agalarov, Donald Trump, Aras Agalarov's wife and daughter, Emin Agalarov, Emin Agalarov's friends Murad and Timur Beniaminov, Roman Beniaminov (no relation), Rob Goldstone, Goldstone and Agalarov's associate Murtaza Akbar, Trump Organization employees Keith Schiller and Michael Cohen, Miss Universe Organization employee Esther Swan, former-Miss Universe Olivia Culpo, and others.","Esther Swan","Miss Universe Organization","neutral1"
"3044","On November 7, Emin Agalarov directed Beniaminov to work with Agalarov's head of security to confirm Trump's security guard.","Emin Agalarov","Beniaminov","neutral1"
"3045","Goldstone recalled that he remained at the party until Trump and Schiller left to return to the hotel, again with a police escort and security.","Schiller","Trump","positive2"
"3046","These additional DCLeak Account administrator personas included ""Richard Gingrey"" and ""Jason Scott.""","Richard Gingrey","DCLeak Account","neutral1"
"3047","In the letter, Rozov wrote that ""the tallest building in Europe should be in Moscow, and I am prepared to build it.""","Rozov","Michael Cohen","neutral2"
"3048","In early 2018, Manafort asked Laurance Gay, a friend of Manafort and Gates, to dissuade Gates from accepting a plea agreement.","Gates","Laurance Gay","positive2"
"3049","According to Beniaminov, attendees at the dinner included Aras Agalarov, Donald Trump, Aras Agalarov's wife and daughter, Emin Agalarov, Emin Agalarov's friends Murad and Timur Beniaminov, Roman Beniaminov (no relation), Rob Goldstone, Goldstone and Agalarov's associate Murtaza Akbar, Trump Organization employees Keith Schiller and Michael Cohen, Miss Universe employee Esther Swan, former-Miss Universe Olivia Culpo, and others.","Olivia Culpo","Roman Beniaminov","neutral2"
"3050","At a dinner on Friday, May 5, attended by the President and various advisors and family members, including Jared Kushner and senior advisor Stephen Miller, the President stated that he wanted to remove Comey and had ideas for a letter that would be used to make the announcement.","the President","Stephen Miller","neutral2"
"3051","Stone, however, maintained his prediction that Assange would be releasing Clinton materials.","Assange","Clinton","negative1"
"3052","Deripaska hired Manafort and Manafort's firm to work on the Montenegrin independence referendum.","Deripaska","Manafort's firm","positive1"
"3053","Other senior Trump Campaign advisors, including Flynn, Kushner, Manafort, Lewandowski, then Senator Jeff Sessions, and Trump Campaign policy advisor Sam Clovis also expressed interest in obtaining the emails.","Kushner","Trump Campaign","positive1"
"3054","The day after the election, Kilimnik raised with Patten the idea of ""talking to Paul"" in order to find a job for Patten in the incoming administration.","Kilimnik","Patten","positive2"
"3055","Cohen recalled that at some point in this approximate time period he also discussed the possibility of traveling to Russia with Trump.","Cohen","Trump","neutral2"
"3056","Stone also tweeted at WikiLeaks and the Guccifer 2.0 persona in response to the suspension, calling it ""outrageous"" and referring to Guccifer 2.0 as a ""HERO.""","Stone","Guccifer 2.0","positive1"
"3057","According to Beniaminov, attendees at the dinner included Aras Agalarov, Donald Trump, Aras Agalarov's wife and daughter, Emin Agalarov, Emin Agalarov's friends Murad and Timur Beniaminov, Roman Beniaminov (no relation), Rob Goldstone, Goldstone and Agalarov's associate Murtaza Akbar, Trump Organization employees Keith Schiller and Michael Cohen, Miss Universe employee Esther Swan, former-Miss Universe Olivia Culpo, and others.","Timur Beniaminov","Esther Swan","neutral2"
"3058","Among other things, WikiLeaks also asked Guccifer 2.0 if it had ""any bigger datasets"" and whether it had received ""our fast transfer details,"" and suggested that WikiLeaks had taken the step of "".arrang[ing] that server just for that purpose"" presumably referring to the transfer of more data.","Wikileaks","Guccifer 2.0","neutral2"
"3059","GRU officers also used the DCLeaks Facebook account, the Twitter account @dcleaks_, and the email account dcleaksproject@gmail.com to communicate privately with reporters and � other U.S. persons.","dcleaksproject@gmail.com","GRU","neutral2"
"3060","Bannon, who continued to defend Sessions, and who believed that he had militantly—indeed with scathing attacks on the Jarvankas for their stupidity—walled himself off from the Comey smashup, was now suddenly getting calls from reporters with leaks that painted him as an engaged participant in the Comey decision.","Bannon","Sessions","positive2"
"3061","In addition, Trump publicly requested that Russia find and release the ""missing"" emails from Clinton's server, and hours later, GRU hackers attempted new spear phishing attacks against the Clinton Campaign.","GRU","the Clinton Campaign","negative1"
"3062","Chris Christie had personally pained Trump not to be able to give it to him.","Trump","Chris Christie","positive2"
"3063","Beginning in April or May 2016, Roger Stone repeatedly conveyed to Trump and senior Trump Campaign staff that WikiLeaks would be releasing information damaging to Clinton.","Roger Stone","Trump Campaign","neutral2"
"3064","The Jarvanka people pushed Priebus to refer the matter to the White House counsel, billing this as the most verbally abusive moment in the history of the West Wing, or at least certainly up among the most abusive episodes ever.","The Jarvanka","Priebus","negative1"
"3065","According to Manafort, at one point in 2014, the OB owed Manafort about $4 million.","OB","Manafort","negative2"
"3066","According to Kaveladze, ""Ms. Veselnitskaya represents Crocus Group in numerous real estate-related, land-related transactions.""","Veselnitskaya","Crocus Group","positive2"
"3067","James Comey Jr. was scheduled to testify before Congress on May 3, 2017.","James Comey Jr.","Congress","neutral2"
"3068","Emin's father has asked me to pass on his congratulations in a letter enclosed below for Mr. Trump on the eve of Super Tuesday vote -- offering his support and that of many of his important Russian friends and colleagues - especially with reference to U.S. / Russia relations.","Emin's father","Trump","positive1"
"3069","On Sunday, October 27, Svetlana Bignova, Grachev's deputy, sent an email to Goldstone, Emin Agalarov, Kaveladze, Grachev, and Beniaminov.","Svetlana Bignova","Grachev","neutral1"
"3070","For example, Russian government media RT announced:""'Guccifer 2.0' releases hacked DNC docs revealing mega donors, Clinton collusion.""","Guccifer 2.0","DNC","negative1"
"3071","Starting in the early 2000s, the Trump Organization and Donald Trump repeatedly sought assistance from Sater to close a real estate deal in Russia.","Donald Trump","Sater","positive1"
"3072","On January 30, 2016, during a meeting with Barrack, Manafort requested Barrack's help in obtaining a position on the Trump Campaign.","Manafort","Barrack","positive1"
"3073","With the president promising that he would make up his mind by August, and McMaster, Mattis, and Tillerson pressing for a decision as soon as possible, Bannon-inspired media began a campaign to brand McMaster as a globalist, interventionist, and all around not-our-kind-of-Trumper—and, to boot, soft on Israel.","McMaster","Trump","negative1"
"3074","Akhmetov and other oligarchs in Ukraine began funding Manafort's work there, while Deripaska provided Manafort other funding and strategic guidance as part of a broader influence campaign.","Deripaska","Manafort","positive1"
"3075","On November 5, 2016, Manafort sent a document entitled ""Securing the Victory"" to at least Trump, Kushner, and Reince Priebus.","Manafort","Trump","neutral2"
"3076","In an email to Patten responding to the public revelation of Kilimnik's campaign correspondence with Manafort, Kilimnik suggested that the Russians were ""idiots"" who were ""too disorganized"" to conduct such interference and that they ""distrusted"" Manafort too much to use him in any election meddling.","Russia","Manafort","negative1"
"3077","Manafort's work with Deripaska also included a joint business venture known as Pericles Emerging Market Partners L.P., a private equity fund designed to be focused on foreign investment in eastern Europe, particularly Ukraine, Russia, and Montenegro.","Manafort","Pericles Emerging Market Partners L.P.","neutral2"
"3078","Mr. Akhmetshin and Mr. Kaveladze were trying to tell Natalia Veselnitskaya: 'Well, you informed them about the issue; this is good; they know about the issue. '","Kaveladze","Natalia Veselnitskaya","positive1"
"3079","Late that evening, between 11 :28 p.m. and 12:09 a.m., Manafort and Kilimnik also exchanged approximately ten text messages.","Manafort","Kilimnik","neutral2"
"3080","I am more than sure that it will be resolved and Konstantin Kilimnik and Paul Manafort will get back to the original relationship with Oleg Deripaska.","Paul Manafort","Oleg Deripaska","positive1"
"3081","Ledeen, a long-time Senate staffer who had previously sought the Clinton emails, provided updates to Flynn about her efforts throughout the summer of 2016.","Ledeen","Senate","neutral1"
"3082","Kondratyev is the Chair of the Security and Defense Committee in the Russian Federation Council.","Kondratyev","Security and Defense Committee","neutral1"
"3083","Wikileaks and Guccifer 2.0 exchanged a total of 82 messages that day alone.","Wikileaks","Guccifer 2.0","neutral2"
"3084","On June 14, 2016, Goldstone emailed Graff, writing that he trusted that his colleagues ""were able to deliver the birthday painting for Mr. Trump today"" and asking her to ""[p]lease pass on my sincere birthday good wishes along with those of Emin and Aras and as always thank you for all your help.""","Goldstone","Graff","neutral2"
"3085","He admitted, however, that he did not think about whether WikiLeaks was acting as a pass-through for Russia or otherwise consider WikiLeaks's history of hostile actions against the United States.","WikiLeaks","Russia","positive1"
"3086","Manafort told the FBI that, after his resignation, but before the election, he and Trump had spoken ""a few times. ""","Manafort","Trump","neutral2"
"3087","Sam Nunberg, another Trump adviser at the time, was angered to learn from a Republican operative that Cohen had raised the subject with Ed Cox, chairman of New York’s GOP.","Cohen","Ed Cox","neutral2"
"3088","However, two months later, on October 17, a Washington Examiner story titled ""Putin loves Donald Trump,"" prominently featured Rykov and his Kremlin ties.","Putin","Trump","positive1"
"3089","Gates himself recalled having a conversation with Stone in which Stone said that the WikiLeaks July 22 release was what Stone had previously predicted would come out, and that additional information would be coming.","Gates","Stone","neutral2"
"3090","In approximately 2000, Bayrock, led by Sater and Arif, leased office space on the 24th floor of Trump Tower in New York, which ultimately led to Sater's introduction to Trump.","Sater","Trump","neutral1"
"3091","As with the chemical attack in Syria, it was Dina Powell—even as she made increasingly determined efforts to get herself out of the White House, either on a Sheryl Sandberg trajectory or, stopping first at a way station, as ambassador to the United Nations—who struggled to help support the least disruptive, most keep-all-options-open approach.","Dina Powell","White House","negative1"
"3092","Two of these proposals came to Michael Cohen, then an executive vice president at the Trump Organization and personal attorney to Trump, from individuals with strong connections in Russia who had done business with Trump and the Trump Organization in the past.","Michael Cohen","Trump","neutral1"
"3093","WikiLeaks wrote that the link would help Trump in ""digging through"" leaked emails and stated, ""we just released Podesta emails Part 4.""","WikiLeaks","Trump","positive1"
"3094","Goldstone wrote to Graff and Shugart with a follow up request for another signed letter from Trump.","Goldstone","Graff","neutral2"
"3095","Aras Agalarov was personally involved in pushing for the meeting between Veselnitskaya and the Trump Campaign, and also pushed for a second meeting for Veselnitskaya following the election, which did not take place.","Veselnitskaya","Trump Campaign","neutral2"
"3096","Phone records for June and July reflect a total' of 28 calls between Gates and Stone and a total of 18 between Manafort and Stone, including those described below.","Gates","Stone","neutral2"
"3097","Gates believed that between approximately 2014 and 2016, Manafort asked Kilimnik to communicate with Deripaska, who contacted Deripaska's ""chief of security,"" Viktor Boyarkin, presumably about Pericles.","Viktor Boyarkin","Deripaska","neutral1"
"3098","In the memoranda to Kolesnikov, Akhmetov, and Lyovochkin, Manafort also wrote that he was interested in Ukrainian politics and implied he might be interested in assisting them: I am watching intently at the prospects ofa new Ukraine government potentially forming in the coming days.","Manafort","Kolesnikov","neutral2"
"3099","Donald Trump invited his daughter Ivanka, an amorphous adviser without an official title, into sensitive meetings, and cheered his policy aide Stephen Miller when he went on television to peddle baseless conspiracy theories about phantom Massachusetts residents voting illegally in New Hampshire last fall.","Donald Trump","Stephen Miller","positive1"
"3100","Kaveladze told the Committee that his primary interlocutor at the Trump Organization was Trump Jr., and that Emin and Aras Agalarov were both involved on the Crocus Group side.","Aras Agalarov","Crocus Group","neutral2"
"3101","Flynn equivocated, and Anton, suddenly concerned, advised him that if he couldn’t be sure they ought to “walk it back.”","Anton","Flynn","positive1"
"3102","Thus, although it is clear that the stolen DNC and Podesta documents were transferred from the GRU to WikiLeaks,","GRU","Podesta","negative1"
"3103","Veselnitskaya helped represent Prevezon Holdings in the case.","Veselnitskaya","Prevezon Holdings","positive2"
"3104","Then Natalia Veselnitskaya said: ""What does Rinat Akhmetshin think Natalia Veselnitskaya should tell him?""","Natalia Veselnitskaya","Rinat Akhmetshin","neutral2"
"3105","When asked about Trump's dismissal of his projected ventilator needs later Friday, Cuomo told CNN's Erin Burnett, ""I hope he's right.""","Trump","Cuomo","negative1"
"3106","In mid-2017, Kilimnik and Patten organized a survey at Kilimnik's urging to, in part, discreetly measure voters' openness to Yanukovych's return.","Kilimnik","Patten","positive2"
"3107","Polonskaya is a Russian citizen who Mifsud used as a proxy for his activities.","Mifsud","Polonskaya","positive1"
"3108","According to Beniaminov, attendees at the dinner included Aras Agalarov, Donald Trump, Aras Agalarov's wife and daughter, Emin Agalarov, Emin Agalarov's friends Murad and Timur Beniaminov, Roman Beniaminov (no relation), Rob Goldstone, Goldstone and Agalarov's associate Murtaza Akbar, Trump Organization employees Keith Schiller and Michael Cohen, Miss Universe employee Esther Swan, former-Miss Universe Olivia Culpo, and others.","Murtaza Akbar","Timur Beniaminov","neutral2"
"3109","In mid-October, Ivanka Trump tasked the Trump Campaign's senior officials (including: Bannon, Scavino, Stephen Miller and Jason Miller) with preparing two Trump tweets every day linking to WikiLeaks content, which, she said, would help ""refocus the narrative.""","Bannon","Trump Campaign","neutral1"
"3110","The Russian contacts consisted of business connections, offers of assistance to the Trump Campaign, invitations for candidate Trump and Putin to meet in person, invitations for Trump Campaign officials and representatives of the Russian government to meet, and policy positions seeking improved U.S.-Russian relations.","Russia","Trump Campaign","positive2"
"3111","Trump and Kushner were reportedly willing to ""cooperate"" with the RNC's efforts on this front, overcoming their earlier skepticism of working with the RNC, and demonstrating that both were focused on the possibility of WikiLeaks. releasing Clinton documents.","Kushner","RNC","positive1"
"3112","Sater also told Cohen that the next step was to get Putin ""on board.""","Sater","Cohen","neutral2"
"3113","Kilimnik remained deeply involved in Manafort's efforts to assist the OB.","Kilimnik","Manafort","positive2"
"3114","Kilimnik reiterated to the associate that Manafort said that they have a ""clever plan of screwing Clinton.""","Kilimnik","Manafort","positive1"
"3115","Later that evening, Cohen and Sater exchanged drafts of the invitation letter, which included the following draft text: In furtherance of our previous conversations regarding the development of the Trump Tower Moscow project, we would like to respectfully invite you to Moscow
for a working visit.","Sater","Cohen","neutral2"
"3116","Additionally, according to Gates, Manafort instructed Gates to begin sending Kilimnik certain Trump Campaign polling data and other Campaign updates as a result of this meeting between Manafort and Kilimnik.","Gates","Kilimnik","neutral2"
"3117","Following the meeting with Yakunin, Rohrabacher, Behrends, and the other members of the delegation met with Konstantin Kosachev, the Chairman of the Council of the Federation Committee on Foreign Affairs.","Yakunin","Konstantin Kosachev","neutral2"
"3118","On March 20, 2017, in open-session testimony before HPSCI, Comey stated: I have been authorized by the Department of Justice to confirm that the FBI, as part of our counterintelligence mission, is investigating the Russian government's efforts to interfere in the 2016 presidential election, and that includes investigating the nature of any links between individuals associated with the Trump campaign and the Russian government and whether there was any coordination between the campaign and Russia's efforts ....","FBI","Russian government","negative1"
"3119","Their names are Alex Sapir and Rotem Rosen.""","Alex Sapir","Donald Trump","positive2"
"3120","However, once confronted with travel records showing that Kilimnik was also in Madrid at the same time, Manafort ultimately admitted that he met with Kilimnik in Madrid during the February trip.","Manafort","Kilimnik","neutral2"
"3121","On January 13, 2014, Emin Agalarov and Trump Jr. met in person, along with Goldstone, at Nobu in New York City.","Goldstone","Trump Jr.","neutral2"
"3122","Kilimnik quickly became an integral part of Manafort's operations in Ukraine and Russia, serving as Manafort's primary liaison to Deripaska and eventually managing Manafort's office in Kyiv.","Manafort","Deripaska","positive2"
"3123","It was Chris Christie’s daughter-in-law Ivanka Trump who held the real influence in the Trump circle, who delivered the blow.","Ivanka Trump","Chris Christie","negative2"
"3124","His fortunes flagging in a must-win state, President Donald Trump on Thursday brought back Ron DeSantis who helped him carry the battleground in 2016, overruling the long-standing objections of the Republican governor and Susie Wiles","Susie Wiles","Ron DeSantis","negative1"
"3125","Davis met Deripaska in 2003 through Nathaniel Rothschild, a British investment fund manager and scion of the Rothschild banking dynasty.","Davis","Deripaska","neutral2"
"3126","Trump advisor Carter Page holds secret meetings in Moscow with Sechin and senior Kremlin Internal Affairs official, Diveykin","Carter Page","Sechin","neutral2"
"3127","On September 15, the DCLeaks persona reached out to WikiLeaks on Twitter: hi there!","DCLeaks","Wikileaks","neutral2"
"3128","With Gates's help, Manafort was involved in outreach from the Ukrainian Embassy in the United States to the Trump Campaign in September 2016.","the Ukrainian Embassy","the Trump Campaign","neutral2"
"3129","At 3:38 p.m., Trump Jr. provided his cell phone number.","Rob Goldstone","Emin Agalarov","neutral1"
"3130","It was Steve Bannon’s wall around the president—one that Steve Bannon hoped would keep Jarvanka out.","Steve Bannon","Jarvanka","negative2"
"3131","Throughout 2015 and 2016, Aras Agalarov and Emin Agalarov remained in regular contact with Trump and Trump Jr., often through Graff and Goldstone or other staffworking for the Agalarovs.","Aras Agalarov","Goldstone","neutral2"
"3132","The previously unreported meeting was also attended by Mr. Trump’s campaign chairman at the time, Paul J. Manafort, and by the president’s son-in-law, Jared Kushner.","Paul J. Manafort","Natalia Veselnitskaya","neutral2"
"3133","In late November 2016, Kilimnik sent Manafort a summary of an interview with the head of Ukraine's Specialized Anti-Corruption Prosecutor's Office (SAPO).","Kilimnik","Manafort","neutral2"
"3134","In the midst of the speculation, WikiLeaks reached out directly to Donald Trump Jr. and asked him to ""comment on/push"" a report about Clinton asking whether Assange could be droned.","WikiLeaks","Trump Jr.","neutral2"
"3135","Sater and Bayrock's projects with the Trump Organization included a development in Ft. Lauderdale and the Trump SoHo development in New York.","Sater","Trump Organization","neutral1"
"3136","Among them were messages about a plan to resolve the Ukraine conflict which involved Yanukovych, the same plan that Kilimnik had raised with Manafort during the August 2, 2016 meeting.","Kilimnik","Manafort","neutral2"
"3137","But it was basically that was the dirt Rob Goldstone had, was going to be Russian donors to Hillary's campaign that they had through emails.","Rob Goldstone","Hillary's campaign","negative1"
"3138","In the afternoon following Comey's testimony, the President met with McGahn, Sessions, and Sessions's Chief of Staff Jody Hunt.","Jody Hunt","Sessions","neutral1"
"3139","At the time of the meeting, Yakunin was sanctioned by the United States.","United States","Yakunin","negative1"
