"","sentence","head","tail","relation"
"1111","On November 7, 2016, Goldstone emailed Trump Jr. requesting an invitation to attend an election night party with a mutual friend of Lara and Eric Trump.","Goldstone","Trump Jr.","neutral1"
"1112","At times in his work for the Crocus Group, Kaveladze would travel frequently to Moscow, sometimes for extended periods.","Kaveladze","Crocus Group","neutral1"
"1113","On the same day, Guccifer 2.0 and WikiLeaks exchanged Twitter direct messages once again, during which the GRU sent WikiLeaks an encrypted file and instructions on opening it.","GRU","Wikileaks","positive1"
"1114","PS - Mr. Agalarov is wonderful man and developer.","Donald Trump","Agalarov","positive1"
"1115","Cuomo highlighted his and Trump's working relationship, stressing that ""this is no time for politics -- this is a time for exquisite coordination between the federal government and the state governments, because we need each other.""","Trump","Cuomo","positive2"
"1116","Hawker ultimately attended a meeting in Russia and said he presumed the person he met with was a Russian operative.","Hawker","Russia","neutral2"
"1117","Bannon’s podcast is viewed in the West Wing as unnecessary and unwelcome, two aides said.","Bannon","West Wing","negative1"
"1118","It was a kind of perfect sweet-revenge story: Jared Kushner the son of the wronged man (or, in this case—there’s little dispute—the guilty-as-charged man) uses his power over Chris Christie who wronged his family.","Jared Kushner","Chris Christie","negative2"
"1119","At 11:15 a.m., Trump Jr. responded, ""Yes Rob I could do that unless they wanted to do 3 today instead ... just let me know and ill lock it in either way.","Trump Jr.","Rob","neutral2"
"1120","However, after defendant Papadopoulos informed [Mifsud] about his joining the Trump Campaign, the Professor appeared to take great interest in defendant Papadopoulos.","Papadopoulos","Trump Campaign","positive1"
"1121","Cohen questioned Sater as to why the letter had come from GenBank and not from VTB Bank, telling Sater that he thought Sater was ""speaking to VTB.""","Cohen","Sater","negative1"
"1122","From June 14, 2016, to November 8, 2016, Committee analysis of the DCLeaks Twitter account shows that it sent 259 direct messages to other Twitter accounts, including WikiLeaks and Guccifer 2.0, as _further discussed infra.","DCLeaks Twitter account","Guccifer 2.0","neutral2"
"1123","Cohen also recalled that he spoke with Donald Trump Jr. and lvanka Trump about the project.","Cohen","Donald Trump Jr.","neutral2"
"1124","According to Roman Beniaminov, ""they [Klyushin and Klyushina] were an outside firm that handled social media for Emin around the time of the contest.""","Klyushina","Emin","neutral1"
"1125","Although most commentators believed that the Kremlin was behind the leaked Democratic National Congress/CLINTON e-mails, this remained technically deniable. Therefore the Russians would not risk their position for the time being with new leaked material, even to a third party like WikiLeaks.","Kremlin","Democratic National Congress","negative1"
"1126","On March 21, 2016, Trump announced some of the foreign policy team during a meeting with the editorial board of the The Washington Post.","Trump","The Washington Post","neutral2"
"1127","DCLeaks victims included an advisor to the Clinton Campaign, a former DNC employee and Clinton Campaign employee, and four other campaign volunteers.","GRU","Clinton Campaign","neutral2"
"1128","WikiLeaks did not release additional hacked documents relating to the 2016 U.S. election until October 7, 2016, when it began a month-long process of leaking stolen Podesta emails.","Wikileaks","Podesta","negative1"
"1129","White House officials are distancing themselves from a campaign Donald Trump’s former chief strategist, Steve Bannon, has mounted to defend the president from impeachment, after tensions flared again this weekend between Bannon and Jared Kushner.","White House","Steve Bannon","negative2"
"1130","On March 18, 2016, Trump responded in a hand written note on the original letter from Agalarov.","Trump","Agalarov","neutral2"
"1131","David Kramer called Page’s speech in Moscow and recent comments by Trump on the possibility of lifting sanctions against Moscow “deeply unsettling”.","David Kramer","Page","negative1"
"1132","Cohen told Sater that he was going to terminate the LOI and cease working with Sater, telling Sater that ""[n]ot you or anyone you know will embarrass me in front of Donald Trump when he asks me what is happening.""","Cohen","Donald Trump","positive1"
"1133","On July 23, 2017, incoming White House Communications Director Anthony Scaramucci wrote to Goldstone saying that Scaramucci officially started in August but that his door was open, and that ""Obviously there is still pressure on all sides, but if we remain consistent and united I don't envisage any issues we can't ride out.""","Anthony Scaramucci","White House","neutral1"
"1134","On November 22, 2016, Mermoud messaged Gates: ""Ambo just called me .... Said he would welcome meeting with Paul.","Mermoud","Gates","neutral2"
"1135","“Manafort's lawyer told Manafort not to cooperate,” Manafort said.","Manafort's lawyer","Manafort","neutral1"
"1136","Gates recalled traveling to Russia with Kilimnik to meet with Deripaska's representatives there in relation to B-Invest.","Gates","Kilimnik","neutral2"
"1137","Sater recalled telling Shmykov that Cohen was ""freaking out"" and that as a result, Sater ""need[ed] an invitation.""","Sater","Cohen","positive1"
"1138","“I was somebody everyone wanted to be,” said Levine, the brother of Cohen’s mother.","Cohen","Levine","positive2"
"1139","However, Akhmetshin testified to the Committee that he had never met Manafort in person prior to the June 9, 2016 meeting at Trump Tower, but he had known of Manafort due to Manafort's work in Ukraine and their mutual relationship with Lanny Wiles.","Manafort","Lanny Wiles","neutral2"
"1140","Papadopoulos, on his own initiative, met and communicated repeatedly with individuals throughout 2016 to advance the Campaign's relationship with Russia, including London-based Professor Joseph Mifsud and Mifsud associates Olga Polonskaya and Ivan Timofeev.","Papadopoulos","Ivan Timofeev","neutral2"
"1141","Mermoud and Gates discussed the possibility of a call between Trump and Poroshenko instead.","Mermoud","Gates","neutral2"
"1142","After leaving the Trump Campaign in August 2016, Manafort stayed in touch with Trump, Kushner, and others on the Trump Campaign.","Manafort","Kushner","positive2"
"1143","Mr.. Trump was there, Paula; myself,Aras,Emin.","Aras","Emin","neutral2"
"1144","In June 2013, the Miss Universe Organization invited the Agalarovs to Las Vegas to sign the contract and make the announcement alongside Trump during the Miss USA pageant.","Miss Universe Organization","Agalarovs","positive1"
"1145","Two military units of the GRU carried out the computer intrusions into the Clinton Campaign, DNC, and DCCC: Military Units 26165 and 74455.","GRU","DCCC","negative1"
"1146","On June 24, 2013, Rhona Graff, Trump's assistant, wrote to Shugart, informing her that, ""DT wants to send a letter to Putin inviting him to Miss Universe.","Trump","Putin","positive1"
"1147","On January 13, 2014, Emin Agalarov and Trump Jr. met in person, along with Goldstone, at Nobu in New York City.","Emin Agalarov","Trump Jr.","neutral2"
"1148","A number of IRA employees assigned to the Translator Department served as Twitter specialists.","Translator Department","IRA","neutral2"
"1149","In order to expand its interference in the 20 I 6 U.S. presidential election, the GRU units transferred many of the documents they stole from the DNC and the chairman of the Clinton Campaign to WikiLeaks.","GRU","WikiLeaks","neutral2"
"1150","Based on an assessment by the SCO of the Apple operating systems possibly running on Assange's computer, this could reflect the date the GRU staged the stolen emails for transfer to WikiLeaks, because the default setting on some Apple operating systems retains the file creation date of a downloaded file from the original host computer.","GRU","Wikileaks","positive1"
"1151","When Twitter then suspended the Guccifer 2.0 account, WikiLeaks complained: ""@Guccifer _ 2 has account completely censored by Twitter after publishing some files from Democratic campaign #DCCC.""","Twitter","Guccifer 2.0","negative1"
"1152","Speaking to a trusted compatriot in mid October 2016, a close associate of Rosneft President and PUTIN ally Igor SECHIN elaborated on the reported secret meeting between the latter and Carter PAGE, of US Republican presidential candidate's foreign policy team, in Moscow in July 2016","Igor Sechin","Rosneft","neutral1"
"1153","After receiving Kilimnik's November 10, 2016 email, Manafort messaged Gates, writing: ""This makes the Frank project even more timely.","Manafort","Gates","neutral1"
"1154","The timing of Mifsud's visit to Moscow and his subsequent conversation with Papadopoulos are consistent with the timeline of the GRU's cyber penetration of the DNC and DCCC, several weeks before any information about that activity was public.","GRU","DNC","negative1"
"1155","President Donald Trump greets California Gov.-elect Gavin Newsom as he prepares to tour wildfire damage in California on November 17, 2018.","Gavin Newsom","California","neutral1"
"1156","As this project is too important, Michael Cohen is hereby requesting Dimitry Peskov's assistance.","Michael Cohen","Dimitry Peskov","positive1"
"1157","The GRU also destroyed evidence of its activities by deleting logs and computer files that reflected its presence on the DNC and DCCC network, and the AMS paneI.","GRU","DNC","negative1"
"1158","In particular, Manafort voiced a concern that the Clinton Campaign would ""move immediately to discredit the Donald Trump victory and claim voter fraud and cyber-fraud, including the claim that the Russians have hacked into the voting machines and empered with the results.""","Clinton Campaign","Donald Trump","negative1"
"1159","Trump has also struggled to square his hiring pledge with the prosecutorial results of former special counsel Robert Mueller’s investigation, which ensnared his former campaign chairman Paul Manafort, former personal attorney and fixer Michael Cohen, longtime informal political adviser Roger Stone and various other close allies.","Trump","Michael Cohen","negative2"
"1160","Speaking separately, also in July 2016, an official close to Presidential Administration Head, S. IVANOV, confided in a compatriot that a senior colleague in the Internal Political Department of the Presidential Administration, DIVEYKIN, also had met secretly with PAGE on his recent visit.","S. IVANOV","Presidential Administration","neutral1"
"1161","According to Beniaminov, attendees at the dinner included Aras Agalarov, Donald Trump, Aras Agalarov's wife and daughter, Emin Agalarov, Emin Agalarov's friends Murad and Timur Beniaminov, Roman Beniaminov (no relation), Rob Goldstone, Goldstone and Agalarov's associate Murtaza Akbar, Trump Organization employees Keith Schiller and Michael Cohen, Miss Universe employee Esther Swan, former-Miss Universe Olivia Culpo, and others.","Murad","Donald Trump","neutral2"
"1162","Information suggests Kilimnik understood that some of the polling data showed that Clinton's negatives were particularly high; that Manafort's plan for victory called for focusing on Clinton's negatives as much as possible; and that given Clinton's high negatives, there was a chance that Trump could win.","Manafort","Clinton","negative2"
"1163","Or, in Jared and Ivanka’s view, in Sean Spicer family’s defense.","Jared","Sean Spicer","negative1"
"1164","One week later, in the first week of May 2016, Papadopoulos suggested to a representative of a foreign government that the Trump Campaign had received indications from the Russian government that it could assist the Campaign through the anonymous release of information damaging to candidate Clinton.","Russian government","Trump campaign","positive1"
"1165","According to Beniaminov, attendees at the dinner included Aras Agalarov, Donald Trump, Aras Agalarov's wife and daughter, Emin Agalarov, Emin Agalarov's friends Murad and Timur Beniaminov, Roman Beniaminov (no relation), Rob Goldstone, Goldstone and Agalarov's associate Murtaza Akbar, Trump Organization employees Keith Schiller and Michael Cohen, Miss Universe employee Esther Swan, former-Miss Universe Olivia Culpo, and others.","Roman Beniaminov","Aras Agalarov","neutral2"
"1166","During the presidential race, Mr Whitaker, a former United States attorney, also said he would have indicted Mrs Clinton, contradicting Mr Comey’s highly unusual public announcement that he would recommend the Justice Department not charge her over her handling of classified information while secretary of state.","Whitaker","Clinton","negative1"
"1167","The Committee does not know the substance of these conversations, but the pattern and timing of Stone’s calls with Trump and others during this period suggest that the they could have discussed the DNC hack and WikiLeaks.","Stone","Trump","neutral2"
"1168","Dear Don, Aras Agalarov just received a letter and gift for your dad from Mr. Putin, I'm sending all this with my mom who is flying early next week and either Rob or Paula will make sure you guys get it shortly, in the meantime here are some pictures.","Aras Agalarov","Putin","positive2"
"1169","A May 2014 Department of State cable noted that the Russian Government had ""unleashed an unprecedented social media propaganda campaign to shore up domestic support for President Vladimir Putin's policy and to support anti-Kyiv protest activity on the streets of southern and eastern Ukraine.""","Vladimir Putin","Russian Government","positive1"
"1170","Trump Jr. responded that it ""will likely be Paul Manafort (campaign boss) my brother in law and me.""","Paul Manafort","Trump Jr.","neutral1"
"1171","However, the Committee found that FBI overly adhered to the letter of its procedures in dealings with the DNC, rather than recognizing the gap between those procedures and effective the pursuit of its mission, and did not follow its procedures closely enough in the handling of Christopher Steele.","FBI","Christopher Steele","neutral1"
"1172","The first correspondence the Committee is aware of regarding Miss Universe Moscow occurred on January 7, 2013, when Emel Kiral emailed Emin Agalarov and wrote that she enjoyed meeting him, suggested that they meet with her ""contact"" at Miss Universe, and suggested that Agalarov could perform at a Miss Universe pageant that was hosted in Moscow.","Emel Kiral","Emin Agalarov","neutral2"
"1173","After the meetings, Cohen would adjourn to his office at Trump Tower to plan next steps with Michael Caputo, the Republican strategist plotting Trump’s gubernatorial campaign.","Cohen","Michael Caputo","positive2"
"1174","Oknyansky claimed that Caputo accompanied Stone to the meeting and provided an introduction, whereas Caputo did not tell us that he had attended and claimed that he was never told what information Oknyansky offered.","Caputo","Stone","neutral2"
"1175","In September 2015, Trump authorized Cohen to pursue the Sater-related deal.","Cohen","Sater","neutral1"
"1176","Once this was discovered, International Republican Institute fired Kilimnik, and Kilimnik became a formal employee of Manafort's firm.","Manafort","Kilimnik","neutral1"
"1177","In subsequent months, the IRA purchased dozens of advertisements supporting the Trump Campaign, predominantly through the Facebook groups ""Being Patriotic,"" ""Stop All Invaders,"" and ""Secured Borders.""","IRA","Trump Campaign","positive1"
"1178","In 2017, Assange also promised to provide evidence to then-Congressman Dana Rohrabacher that Russia was not his source, but only in exchange for protection from U.S. authorities.","Assange","Dana Rohrabacher","neutral1"
"1179","George Papadopoulos joined the Trump Campaign as part of a foreign policy advisory team created to blunt criticism that the Campaign lacked foreign policy advisors.","George Papadopoulos","the Trump Campaign","neutral1"
"1180","Goldstone was meeting Veselnitskaya, Akhmetshin, and Samochomov for the first time.","Veselnitskaya","Akhmetshin","neutral2"
"1181","Around the same time, WikiLeaks initiated communications with the GRU persona Guccifer 2.0 shortly after it was used to release documents stolen from the DNC.","Guccifer 2.0","DNC","neutral2"
"1182","Klyushin and Klyushina were included on a number of Emin Agalarov and Rob Goldstone's emails prior to, and following, the Miss Universe pageant.","Emin Agalarov","Klyushin","neutral1"
"1183","By late October 2015, Sater, Cohen, and LC. Expert had agreed on terms for a detailed Letter of Intent (LOI).","Cohen","LC. Expert","positive2"
"1184","The investigation focused on Mr. Manafort and a pair of Trump's advisers, Carter Page and Roger J. Stone.","Trump","Roger J. Stone","positive2"
"1185","Section lII of this Report details the Special Counsel Office's investigation into the Russian hacking operations, as well as other efforts by Trump Campaign supporters to obtain Clinton-related emails.","Special Counsel Office's","Russian","negative1"
"1186","Ultimately,·Gates was deposed in November 2015 and Manafort was deposed in December 2015 in relation to the Pericles proceedings, while a dispute over access to, and use of, documents was not resolved until mid-February 2016-in the midst of Manafort's private lobbying to obtain a position on the Trump Campaign.","Manafort","the Trump Campaign","positive1"
"1187","However, Corsi said that Stone was concerned about having advance information about the Podesta release, and that Stone recruited Corsi to make sure no one knew Stone had advance knowledge of that information.","Stone","Corsi","positive1"
"1188","On October 10, 2013, Graff wrote an email titled ""DT's Guests on Trip to Moscow"" to Shugart.","Graff","Shugart","neutral2"
"1189","Sater had separately reached out to a SPIEF official in charge of ""official delegations"" to request assistance to expedite his and Cohen's visas.","Sater","Cohen","positive1"
"1190","However, Manafort also recalled that Trump Jr. told him that they had ''worked with the Trump Organization and he was comfortable.""","Trump Jr.","Manafort","neutral2"
"1191","On March 20, 2017, in open-session testimony before HPSCI, Comey stated: I have been authorized by the Department of Justice to confirm that the FBI, as part of our counterintelligence mission, is investigating the Russian government's efforts to interfere in the 2016 presidential election, and that includes investigating the nature of any links between individuals associated with the Trump campaign and the Russian government and whether there was any coordination between the campaign and Russia's efforts ....","Russian government","U.S. Government","negative1"
"1192","Ledeen claimed to have obtained a trove of emails (from what she described as the ""dark web"") that purported to be the deleted Clinton emails","Ledeen","Clinton","negative1"
"1193","Emin and Irakly “Ike” Kaveladze both said the same continually: 'I know Rob Goldstone didn't want to do this, I know Rob Goldstone didn't want to set it up, but Mr. A[galarov] really wanted it, and it's fine.'""","Irakly “Ike” Kaveladze","Rob Goldstone","positive1"
"1194","Cohen recalled that he relayed the ""the sum and substance of my conversation"" with Klokov to Ivanka Trump, as she had requested.","Cohen","Klokov","neutral2"
"1195","Throughout this time, Manafort and Barrack both communicated with Stone.","Manafort","Stone","neutral2"
"1196","Long before Cohen turned on the president, questions about his trustworthiness had percolated among Trump’s advisers.","Cohen","Trump","negative2"
"1197","Manafort, Kilimnik, and Gates exchanged a number of calls and messages in the lead-up to the meeting.","Manafort","Kilimnik","neutral2"
"1198","The package with the box from Putin was brought to the United States by Irina Agalarova, Aras Agalarov's wife.","Irina Agalarova","Aras Agalarov","positive2"
"1199","Trump and Cuomo, two Queens natives prone to shifting quickly between approval and antagonism, alternately frosty and supportive working relationship.","Trump","Cuomo","positive2"
"1200","However; Kilimnik continued to push the issue, telling Patten that your knowledge of the region is superb, and you could do your country a favor by running policy not based on false perceptions, but on facts:""Patten said he declined Kilimnik's offer.","Patten","Kilimnik","negative1"
"3001","Specifically, Cohen recalled Poliakova asking about the property, including the area, size, and square footage.","Poliakova","Cohen","neutral2"
"3002","In early 2018, Manafort asked Laurance Gay, a friend of Manafort and Gates, to dissuade Gates from accepting a plea agreement.","Manafort","Laurance Gay","positive2"
"3003","Following the dinner, Miller prepared a termination letter based on those notes and research he conducted to support Donald Trump's arguments.","Miller","Donald Trump","positive2"
"3004","The GRU transferred the information stolen from the Clinton Campaign and DNC to WikiLeaks, likely because WikiLeaks offered a more effective platform to disseminate stolen documents than the GRU' s own organic methods.","GRU","DNC","negative1"
"3005","Paul Manafort was the Trump Campaign manager.","Paul Manafort","Trump Campaign","neutral1"
"3006","On March 24, 2016, Papadopoulos met with Mifsud and Olga Polonskaya, a Russian-national, at the Holborn Hotel.","Papadopoulos","Olga Polonskaya","neutral2"
"3007","Less than an hour later, WikiLeaks made its second release: thousands of John Podesta's emails that had been stolen by the GRU in late March 2016.","WikiLeaks","John Podesta","negative1"
"3008","The next day, with more inquiries coming from reporters, Steve Bannon confronted Hicks inside the cabinet room, accusing her of doing Jared and Ivanka’s dirty work.","Steve Bannon","Hicks","negative1"
"3009","As a result, on November 24, 2015, Ivanka Trump received a response from Zaha Hadid Architects to notify her that the firm intended to submit a ""proposal for the new Trump Moscow.""","Zaha Hadid Architects","Ivanka Trump","neutral2"
"3010","On June 22, 2016, seven days after Guccifer 2.0's first releases of stolen DNC documents, WikiLeaks used Twitter's direct message function to contact the Guccifer 2.0 Twitter account and suggest that Guccifer 2.0 ""[s]end any new material [stolen from the DNC] here for us to review and it will have a much higher impact than what you are doing.""","WikiLeaks","Guccifer 2.0","neutral2"
"3011","Buzzfeed obtained the email and the information about Bannon’s interview with Mueller’s team after successfully suing the Department of Justice for unreleased records the special counsel’s office produced during its investigation of Russian interference in the 2016 campaign.","Mueller’s team","Bannon","neutral2"
"3012","Anatoli Samochomov has stated that he was contacted by Robert Arakelian, the president of HRAGI, offering to cover his legal expenses if he was willing to confine his comments regarding the June 9 meeting to public statements already made by Veselnitskaya.","Robert Arakelian","HRAGI","positive2"
"3013","Papadopoulos remembered telling Clovis he did not have any Russian contacts during that call.","Papadopoulos","Clovis","neutral2"
"3014","Later on November 9, Yana Gorokhova from the Crocus Group emailed Goldstone the final signed letter.","Yana Gorokhova","Crocus Group","neutral1"
"3015","Shugart recalled, ""At that point I asked Rob: ' Okay, what was this meeting?'","Shugart","Rob","neutral2"
"3016","In September 2015, Glassner told Papadopoulos that the Trump Campaign was not hiring policy advisors.","Glassner","Papadopoulos","neutral2"
"3017","On December 3, 2015, Barbara Ledeen emailed Smith a proposal to obtain the emails, stating,","Barbara Ledeen","Smith","neutral2"
"3018","Cohen was calling to inform Allon that his boss did not appreciate being excluded from Avenue’s list of the 200 most influential New Yorkers.","Cohen","Allon","neutral2"
"3019","For instance, on October 21, 2016, Manafort sent Kushner an email with an attached memorandum that provided strategy guidance recommending that the Campaign should depict Clinton ""as the failed and corrupt champion of the establishment,"" because ""Wikileaks provides the Trump campaign the ability to make the case in a very credible way -by using the words of Clinton, its campaign officials and DNC members.""","Manafort","Kushner","positive1"
"3020","But the Republicans knew they were getting somewhere when Trump signaled to his attorney that he wanted more talks.","the Republicans","Trump","positive1"
"3021","For example, Hope Hicks, a close aide to Trump on the Campaign, recalled attending a dinner at Mar-a-Lago with Trump and Manafort on March 24.","Trump","Manafort","positive2"
"3022","Before the first meeting about the New York governor’s race, Caputo said Roger Stone, then Trump’s political adviser, warned him that Cohen was “mercurial — you don’t want to get on his bad side.","Roger Stone","Cohen","negative1"
"3023","The Committee assesses that Klyushin is a Kremlin-linked bot developer who has supported Russian influence operations on social media.","Klyushin","Kremlin","neutral1"
"3024","The Carter Page went off topic with effusive praise for Russian President Vladimir Putin and Trump.","Carter PAGE","Vladimir PUTIN","positive1"
"3025","Credico was in London to see a friend and had agreed to deliver a letter to Assange from Berthold Reimers, Manager of the WBAI radio station.","Berthold Reimers","Credico","positive1"
