"","sentence","head","tail","relation"
"525","In April, John R. Bolton became the White House national security adviser.","John R. Bolton","White House","neutral1"
"526","Papadopoulos characterized a transition in their relationship, shifting from ""seemingly obscure girl ... to now the interlocutor with Mifsud to the Russian Government for me.""","Olga Polonskaya","Russian government","neutral1"
"527","These sessions were captured as GRU officers monitored DCCC and DNC employees' work on infected computers regularly between April 2016 and June 2016.","GRU","DCCC","negative1"
"528","Sater claimed that he had had discussions with ""Evgeny"" to this effect.","Sater","Evgeny","neutral2"
"529","According to Patten, Kilimnik has met with Deripaska and Deripaska associates, including Boyarkin.","Kilimnik","Boyarkin","neutral2"
"530","On November14, architects from the firm Jacobs /KlingStubbins who were working on behalf of Crocus emailed Trump Jr. and Florence Khoo at the Trump Organization and copied Emin Agalarov, Kaveladze, and others.","Jacobs /KlingStubbins","Florence Khoo","neutral1"
"531","Manafort's hiring was not made public until March 29, 2016, when the Trump Campaign issued a press release.","Trump Campaign","Manafort","positive1"
"532","Several days later, Rozov's ""right hand man"", Dmitry Chizhikov, sent Cohen a letter from Rozov, attaching a presentation describing Rozov's company, IC Expert.","Rozov","IC Expert","positive1"
"533","Emin just called and asked me to contact Donald Trump Jr. with something very interesting.","Emin","Donald Trump Jr.","positive1"
"534","Classmate Brian Levenstein described Cohen’s clique as the “upper echelon of Woodmere.”","Brian Levenstein","Cohen","neutral1"
"535","Other than Oates's admission that he began using WhatsApp to send polling data to Kilimnik, the Committee has no material information about the content of communications between Manafort or Gates and Kilimnik following the May 7, 2016 meeting until July 7, 2016.","Manafort","Kilimnik","neutral2"
"536","According to Beniaminov, attendees at the dinner included Aras Agalarov, Donald Trump, Aras Agalarov's wife and daughter, Emin Agalarov, Emin Agalarov's friends Murad and Timur Beniaminov, Roman Beniaminov (no relation), Rob Goldstone, Goldstone and Agalarov's associate Murtaza Akbar, Trump Organization employees Keith Schiller and Michael Cohen, Miss Universe employee Esther Swan, former-Miss Universe Olivia Culpo, and others.","Emin Agalarov","Donald Trump","neutral2"
"537","Kilimnik and Patten drafted a paper outlining the plan, which was to decentralize power, limit Kyiv's role in running the country, engage in direct bilateral talks between Poroshenko and Putin, and focus on local elections.","Patten","Kyiv","negative1"
"538","It was another reason for Trump to distrust and hate the FBI, a pernicious tease that left them dangling.","Trump","the FBI","negative2"
"539","Former acting White House chief of staff Mick Mulvaney on Friday acknowledged that Donald Trump “didn’t hire very well” in the earlier stages of his presidency, specifically noting his poor working relationships with administration officials who had ties to the military","Mick Mulvaney","Trump","negative1"
"540","The IRA campaign evolved from a generalized program designed in 2014 and 2015 to undermine the U.S. electoral system, to a targeted operation that by early 2016 favored candidate Trump and disparaged candidate Clinton.","IRA","U.S.","negative1"
"541","Kaveladze's flight to New York arrived around 7:00 a.m. on June 9, and after checking in at his hotel, he waited for the lunch with Veselnitskaya.","Kaveladze","Veselnitskaya","positive1"
"542","At 5:26 p.m., Gates and Kilimnik conducted a 13-minute phone call.","Gates","Kilimnik","neutral2"
"543","On February 15, 2017, Goldstone emailed Graff requesting that she help Goldstone find a copy of Aras Agalarov's previous correspondence with Trump.","Aras Agalarov","Trump","neutral2"
"544","[To: Jared Kushner] [To: Paul Manafort] [From: Donald Trump Jr.]","Trump Jr.","Jared Kushner","neutral2"
"545","A May 2014 Department of State cable noted that the Kremlin had ""unleashed an unprecedented social media propaganda campaign to shore up domestic support for President Vladimir Putin's policy and to support anti-Kyiv protest activity on the streets of southern and eastern Ukraine.""","Russian Government","Ukraine Government","negative1"
"546","Emin Agalarov met with Trump, Ivanka Trump, and Trump Jr. while he was there.","Emin Agalarov","Ivanka Trump","neutral2"
"547","Although most commentators believed that the Kremlin was behind the leaked DNC/CLINTON e-mails, this remained technically deniable. Therefore the Russians would not risk their position for the time being with new leaked material, even to a third party like WikiLeaks.","Kremlin","Clinton","negative1"
"548","Defendant Papadopoulos was interested in [Mifsud] because, among other reasons, [Mifsud] claimed to have substantial connections with Russian government officials, which defendant Papadopoulos thought could increase his importance as a policy advisor to the Campaign.","Mifsud","Russian government","positive1"
"549","Nunberg said Trump’s decision to exclude Cohen helped guarantee that he would turn against the president.","Trump","Cohen","negative1"
"550","White House officials are distancing themselves from a campaign Donald Trump’s former chief strategist, Steve Bannon, has mounted to defend the president from impeachment, after tensions flared again this weekend between Bannon and Jared Kushner.","Steve Bannon","Donald Trump","positive2"
"551","In September 2017, Kilimnik shared a letter with Patten that Lyovochkin and his OB associates drafted allegedly on behalf of Oleksandr Lavrynovych.","Lyovochkin","Oleksandr Lavrynovych","positive2"
"552","Dear Don, My father just received a letter and gift for Donald Trump Jr.'s Dad from Mr. Putin, I'm sending all this with my mom who is flying early next week and either Rob or Paula will make sure you guys get it shortly, in the meantime here are some pictures.","Paula","Donald Trump Jr.","neutral1"
"553","Mr Trump stoked his enmity for Mrs Clinton during the campaign, suggesting during a presidential debate that he would prosecute her if he was elected president.","Trump","Clinton","negative2"
"554","Speaking to a trusted compatriot in June 2016 sources A and B, a senior Russian Foreign Ministry figure and a former top level Russian intelligence officer still active inside the Kremlin respectively, the Russian authorities had been cultivating and supporting US Republican presidential candidate, Donald TRUMP for at least 5 years","Russian authorities","Donald Trump","positive2"
"555","Rybka also suggested that she was in possession of more than 16 hours of audio recordings she made of Deripaska's conversations with business associates and Russian political leaders, namely Russian Deputy Prime Minister Sergei Prikhodko.","Deripaska","Sergei Prikhodko","neutral2"
"556","Goldstone wrote several emails to Kaveladze, Emin Agalarov, Beniaminov, and three Russian employees of Crocus Group regarding hotel options for the pageant.","Goldstone","Beniaminov","neutral2"
"557","On January 6, 2017, members of the intelligence community briefed President-Elect Trump on a joint assessment-drafted and coordinated among the Central Intelligence Agency, FBI, and National Security Agency-that concluded with high confidence that Russia had intervened in the election through a variety of means to assist Trump's candidacy and harm Clinton's.","National Security Agency","President-Elect","neutral2"
"558","As a result of this direct outreach to the Russian Presidential Administration and Sater's separate efforts to conduct outreach to individuals in Russia, the Committee found that senior Russian government officials including almost certainly President Vladimir Putin were aware of the deal by January 2016.","Vladimir Putin","Russian Government","positive1"
"559","Publicly, Assange also argued against Clinton's candidacy based on his perception of her U.S. defense and national security views.","Assange","Clinton","negative1"
"560","In the request, Cohen asked to speak with Sergei Ivanov, Putin's chief of staff.","Sergei Ivanov","Putin","neutral1"
"561","Feinstein, a mentor to Newsom, said. ""And people aren't ready for it.""","Feinstein","Newsom","positive2"
"562","I said: 'Who was at the meeting?","Paula Shugart","Rob Goldstone","neutral2"
"563","Prigozhin was sanctioned by the U.S. Treasury Department in December 2016","U.S. Treasury Department","Prigozhin","negative1"
"564","[From: Konstantin Sidorkov] [Subject: Donald Trump on VK] [To:Rob Goldstone]","Konstantin Sidorkov","Rob Goldstone","neutral2"
"565","The GRU also destroyed evidence of its activities by deleting logs and computer files that reflected its presence on the DNC and DCCC network, and the AMS paneI.","GRU","DCCC","negative1"
"566","On April 22, 2016, Kilimnik told an associate that Manafort had a ""clever plan"" for beating Clinton and expressed confidence that with Manafort' s help, Trump would win.","Kilimnik","Manafort","positive1"
"567","Later that day, June 3, 2016, Goldstone emailed Emin Agalarov, telling him that Trump Jr. wanted ""to speak personally on the issue with you early next week.""","Trump Jr.","Emin Agalarov","positive1"
"568","Prior to the public announcement of Manafort's new position on the Trump Campaign, Manafort reached out to Kilimnik, with whom Manafort had remained in contact, to notify him of the development.","Manafort","Trump Campaign","neutral1"
"569","According to an email that morning from Stone to Macchia, Trump had ""asked [Stone] for some other things"" that Stone said he was ""writing now.""","Stone","Macchia","neutral2"
"570","On July 23, the Trump Campaign used the release to attack the Democratic Party, saying that the ""anti-Bernie DNC email leak issue threatens to destroy their party.""","Trump Campaign","Democratic Party","negative1"
"571","Ivanka Trump responded that she would ""print and show the attached and below to DJT following Super Tuesday:""","Thomas Barrack","Ivanka Trump","neutral2"
"572","Kilimnik and Patten circulated a draft of the article in January 2017, which included language suggesting that Ukraine's National Anti-Corruption Bureau (NABU) had ""manufactured a case"" against Manafort","Kilimnik","Patten","neutral1"
"573","Ivanka Trump said hello to Irakly “Ike” Kaveladze.","Ivanka Trump","Irakly “Ike” Kaveladze","neutral1"
"574","On September 22, 2016 (the same day of DCLeaks' email to WikiLeaks), the Twitter account dcleaks sent a single message to WikiLeaks with the string of characters.","DCLeaks","WikiLeaks","neutral2"
"575","Cohen further stated that he understood that the pardon discussions had come from Trump through Sekulow.","Sekulow","Trump","neutral2"
"576","Cyber Berkut has leaked a wide variety of hacked material and conducted other computer network operations and influence campaigns on behalf of the Russian government.","Cyber Berkut","Russian government","neutral1"
"577","Special counsel Robert Mueller planned to ask Trump himself about his discussions with Sater and Cohen about the Trump Moscow project, according to the New York Times.","Trump","Cohen","neutral2"
"578","Rtskhiladze had previously worked with the Trump Organization, and Cohen in particular, on at least two other business projects.","Rtskhiladze","Cohen","positive1"
"579","Kilimnik was hired by IRI ""fresh out of Russian Ministry of Defense.""","Kilimnik","IRI","neutral1"
"580","Second, a Russian intelligence service conducted computer-intrusion operations against entities, employees, and volunteers working on the Clinton Campaign and then released stolen documents.","Russia","Clinton campaign","negative1"
"581","We reported previously (2016/135 and / 136) on secret meeting/s held in Prague, Czech Republic, in August 2016 between then Republican presidential candidate Donald TRUMP's representative, Michael COHEN and his interlocutors from the Kremlin working under cover of Russian 'NGO' Rossotrudnichestvo.","Michael Cohen","Kremlin","neutral2"
"582","Goldstone transmitted the scanned letter to Graff, asking that she ""kindly pass this letter from Aras and Emin Agalarov to Mr. Trump.""","Aras","Trump","positive1"
"583","Oknyansky was accompanied to the meeting by Alexei Rasin, a Ukrainian associate involved in Florida real estate.","Oknyansky","Alexei Rasin","neutral2"
"584","Gates recalled that in addition to Trump Jr., Eric Trump, Manafort, and Hope Hicks attended the meeting, while Ivanka Trump and Jared Kushner joined the meeting late.","Trump Jr.","Hope Hicks","neutral2"
"585","Kilimnik reiterated to the associate that Manafort said that they have a ""clever plan of screwing Clinton.""","Kilimnik","Clinton","negative1"
"586","Later that day, Stone emailed Credico an article about the change in Assange' s announcement, to which Credico responded, ""head fake.""","Stone","Credico","neutral2"
"587","Veselnitskaya, Samochornov, Akhmetshin, and Kaveladze went briefly to a bar in Trump Tower for a drink.","Veselnitskaya","Akhmetshin","positive1"
"588","The same day, a representative from the Trump Campaign responded to Papadopoulos with the subject line, ""follow up from Michael Glassner,"" to confirm that Papadopoulos would like to be introduced to Sam Clovis, who was the National Co-Chair and Chief Policy Adviser for the Trump Campaign and was at that time charged with forming a foreign policy team for the Trump Campaign.","Michael Glassner","Papadopoulos","neutral2"
"589","While the Batumi project was never completed, the Trump Organization received approximately $1 million from George Ramishvili of the Silk Road Group in connection with the project.","Silk Road Group","George Ramishvili","positive1"
"590","Phone records support this claim, showing that from March 1, 2016, to March 16, 2016, Stone made or received calls from Trump-associated numbers at least ten times.","Stone","Trump","neutral2"
"591","Paul Manafort's calendar for June 9, 2016, shows that he was scheduled to meet with Trump at 10:30 a.m.","Paul Manafort","Trump","neutral2"
"592","Cohen recalled speaking with Lewandowski shortly thereafter.","Cohen","Lewandowski","neutral2"
"593","This project failed to materialize, but the Fotiadis building design would ultimately be revisited by Cohen in September 2015 as part of a potential Trump Tower Moscow project.","Cohen","Fotiadis","positive1"
"594","During his calls with Aras Agalarov on the previous day, Kaveladze was told that the meeting would be with ""Trump people,"" but that he was given no specifics regarding who would attend.","Aras Agalarov","Kaveladze","neutral2"
"595","Manafort underscored, however, that he and Fabrizio needed to be ""in control"" of Fabrizio's polling data, including what Manafort described as ""the sensitive stuff.""","Manafort","Fabrizio","neutral2"
"596","On June 29, 2016, Goldstone emailed Dan Scavino, copying Trump Jr., Graff, and Sidorkov, reiterating his previous offers to create a ""VOTE Trump 2016"" page on the Russian social networking site.","Goldstone","Trump Jr.","neutral2"
"597","The Trump Campaign hired Manafort in mid-March 2016 after conducting no known vetting of him, including of his financial situation or vulnerability to foreign influence.","Trump Campaign","Manafort","neutral1"
"598","In it, Boyle had asked Stone, ""Assange - what's he got? Hope it's good.""","Boyle","Stone","neutral2"
"599","Sater first began working with the Trump Organization in the early 2000s while he was an executive at Bayrock, a New York-based real estate and development company.","Sater","Bayrock","neutral1"
"600","Regarding the Steele Dossier, FBI gave Steele's allegations unjustified credence, based on an incomplete understanding of Steele's past reporting record.","FBI","Steele Dossier","positive1"
"2401","October 12, 2016: ""This WikiLeaks stuff is unbelievable. It tells you the inner heart, you gotta read it.""","Donald Trump","WikiLeaks","positive1"
"2402","“This guy is doing an amazing job,” Steve Bannon tells TIME of Priebus.","Steve Bannon","TIME","neutral2"
"2403","Shortly thereafter, on March 25, 2017, Waldman discussed with Vice Chairman Warner the possibility of a potential Committee engagement with Deripaska.","Waldman","Warner","neutral2"
"2404","Agalarov's letter then made a series of economic and trade observations and recommendations, including suggesting that Trump should promote a ""Made in USA"" promotion campaign to target international markets.","Agalarov","Trump","positive1"
"2405","She recalled, ""that was the reason for a lot of these letters - we were all trying to ensure that this meeting happened for Donald with Mr. Putin, because that was the request whenever we spoke about it, whenever we spoke about the pageant and the event.""","Donald","Putin","positive1"
"2406","In a subsequent interview, Assange commented about the WikiLeaks interest in the Rich case as concerning ""someone who's potentially connected to our publication.""","WikiLeaks","Rich","positive1"
"2407","Sater also told the Committee that he used Evgeny Shmykov, the former Russian Government intelligence officer, as a conduit to VTB.","Evgeny Shmykov","Russian Government","neutral1"
"2408","After the election, Cohen was part of an alleged joint defense agreement (JDA) with an unknown number of other Trump-affiliated individuals, including Trump himself, the Trump Organization, Jared Kushner, Ivanka Trump, Felix Sater, and others.","Cohen","Trump","positive2"
"2409","Within minutes of receiving Kilimnik's email, Manafort responded to Kilimnik, telling him that ""Tuesday is best.""","Kilimnik","Manafort","neutral2"
"2410","Barrack sent the same email and attachments to Ivanka Trump and Jared Kushner, stating ""I think it is really, really important and Manafort is a genius killer but the opposite of Stone.""","Barrack","Ivanka Trump","neutral2"
"2411","Sater later explained to the Committee that his offers to Cohen related to high-level meetings, including potentially with Putin, were real and attainable.","Sater","Cohen","positive1"
"2412","Kushner and his wife, Ivanka Trump, who are both senior advisers to Donald Trump, were angered by revelations about Bannon’s interactions with Special Counsel Robert Mueller that emerged on Saturday, three people familiar with the matter said","Kushner","Donald Trump","positive2"
"2413","That day, Stone tweeted: ""I have total confidence that @wikileaks and my hero Julian Assange will educate the American people soon #LockHerUp.""","Stone","Assange","positive1"
"2414","Anatoli Samochornov recalls them entering through the left side, and they were met by Donald Trump Junior and Anatoli Samochornov believes Mr. Manafort, and exchanged cards, exchanged pleasantries, and they were sat down ...","Anatoli Samochornov","Manafort","neutral2"
"2415","Continuing on this theme, Source G, a senior Kremlin official, confided that the Clinton dossier was controlled exclusively by chief Kremlin spokesman, Dmitriy Peskov, who was responsible for compiling/handling it on the explicit instructions of Putin himself","Dmitriy Peskov","Putin","neutral1"
"2416","At some point shortly after Cohen's call with Peskov's assistant, Cohen told Trump about the call.","Cohen","Trump","neutral2"
"2417","Agalarov responded, thanking Emel Kiral and saying that he would look at the slides.","Agalarov","Emel Kiral","neutral2"
"2418","Kilimnik remained deeply involved in Manafort's efforts to assist the OB.","Kilimnik","OB","positive2"
"2419","Papadopoulos engaged both Polonskaya and Timofeev, along with Mifsud, as part of his outreach to Russia.","Papadopoulos","Polonskaya","neutral1"
"2420","On October 8, Stone messaged Corsi: ""Lunch postponed - have to go see T,"" referring to Trump.","Stone","Corsi","neutral2"
"2421","""Mr McGahn will not comment on Mr McGahn legal advice to Donald Trump,"" said Mr McGahn lawyer, William Burck.","McGahn","Donald Trump","positive1"
"2422","In June and July 2016, prior to the release of DNC materials by WikiLeaks, the Campaign worked on a ""messaging strategy"" based on ""the possible content of ah upcoming release.","WikiLeaks","DNC","neutral1"
"2423","On September 22, 2015, Cohen received updated architectural renderings from Fotiadis.","Fotiadis","Cohen","neutral2"
"2424","Throughout 2015 and 2016, Aras Agalarov and Emin Agalarov remained in regular contact with Trump and Trump Jr., often through Graff and Goldstone or other staffworking for the Agalarovs.","Aras Agalarov","Trump","neutral2"
"2425","Papadopoulos's wife, Mangiante, told the Committee that Papadopoulos thought Polonskaya was President Putin's niece because of the way Mifsud introduced her to Papadopoulos.","Mifsud","Papadopoulos","neutral1"
"2426","On June 14, 2016, Cohen and Sater met in person in Trump Tower, and Cohen likely relayed that he would not be able to travel to Russia at that time.","Cohen","Sater","neutral2"
"2427","Sater recalled: Mikhail Ziats joined us [Sater and Rozov] in the Bahamas.","Mikhail Ziats","Rozov","neutral2"
"2428","Cohen recalled Graff bringing him Trump's passport, but no records or testimony obtained by the Committee indicate that Trump's passport was ever transmitted to Sater.","Graff","Cohen","neutral1"
"2429","During this time, Manafort believed the OB and its backers owed him money.","OB","Manafort","negative2"
"2430","The order appointing the Special Counsel authorized him to investigate ""the Russian government's efforts to interfere in the 2016 presidential election,"" including any links or coordination between the Russian government and individuals associated with the Trump Campaign.","Special Counsel","Russian government","negative1"
"2431","Dear Don, My father just received a letter and gift for Donald Trump from Mr. Putin, I'm sending all this with my mom who is flying early next week and either Rob or Paula will make sure you guys get it shortly, in the meantime here are some pictures.","Rob","Donald Trump","neutral1"
"2432","The most recognizable victim of this spearphishing effort was John Podesta, the chairman of the Clinton Campaign.","GRU","John Podesta","negative1"
"2433","The DCLeaks Twitter account was registered under the Gmail address dcleaksproject@gmail.com and from an IP address that resolved to a U.S. webhosting company based in Williamsville, New York.","DCLeaks Twitter account","dcleaksproject@gmail.com","neutral1"
"2434","Kaveladze testified that he asked Beniaminov: ""Roman, what's happening?","Kaveladze","Beniaminov","neutral1"
"2435","Rohrabacher, convinced that the Russians were now being accused of something they didn't do,"" instead ""felt like [he] needed to go see how [he] could prove that one way or the other"" by speaking with Assange.","Rohrabacher","Assange","neutral2"
"2436","Separately, Stone communicated with Randy Credico between August and October 2016 in an attempt to obtain advance information about WikiLeaks, but Credico denied having any non-public knowledge, despite having some connections to Assange.","Randy Credico","Assange","neutral2"
"2437","Donald Trump knows of one big reason, which is your son, Emin, who has brought a lot of elegance and excitement to my pageants.","Donald Trump","Emin","positive1"
"2438","The alliance between RT and WikiLeaks is part of the Russian Government's overall strategy to use its state-controlled media to undermine U.S. democratic institutions.","Russian Government","U.S.","negative1"
"2439","Cohen responded, ""I need to talk to you.""","Cohen","Felix Sater","neutral2"
"2440","It was Steve Bannon’s wall around Donald Trump—one that Steve Bannon hoped would keep Jarvanka out.","Steve Bannon","Donald Trump","positive1"
"2441","Cohen initially agreed to travel to Russia and forwarded passport information to Sater.","Cohen","Sater","neutral1"
"2442","As described infra, emails, testimony, and records show that Kilimnik had, in fact, engaged in an effort to return Yanukovych to Ukraine since 2016 and extending to at least 2018.","Kilimnik","Yanukovych","positive1"
"2443","However, later that day, Emin Agalarov wrote to Roman Beniaminov and Crocus employee Katia Kosenkova, - directing them to arrange for Trump to stay at the Ritz Carlton.","Emin Agalarov","Roman Beniaminov","neutral2"
"2444","Bannon recalled discussing WikiLeaks and Assange with Stone both before and after taking over as the chief executive officer of the Trump Campaign on August 13, 2016.","Bannon","the Trump Campaign","neutral1"
"2445","Primarily, however, Manafort and DMP were funded by Lyovochkin and Akhmetov.","Lyovochkin","DMP","positive1"
"2446","These operations may have been directly related to the Russian intelligence services.","Paul Manafort","Russian intelligence services","neutral1"
"2447","On April 22, 2016, Kilimnik told an associate that Manafort had a ""clever plan"" for beating Clinton and expressed confidence that with Manafort' s help, Trump would win.","Manafort","Trump","positive1"
"2448","The first known IRA advertisement explicitly endorsing the Trump Campaign was purchased on April 19, 2016.","IRA","Trump Campaign","positive1"
"2449","Russia applied these same technologies and methodologies to its influence campaign during the 2016 election and, in doing so, conducted foreign influence operations against the United States with a speed, precision, and scale not previously seen.","Russia","the United States","negative1"
"2450","In particular, the cable noted that accounts including Klyushin (@artem_klyushin) and Konstantin Rykov (@Rykov) tweeted ""pro-Kremlin patriotic propaganda about events in Ukraine nearly 24 hours a day to tens of thousands - or in Klyushin' s case, 1.4 million - followers.""","Klyushin","Kremlin","positive1"
